prepro,encoding
i m against gamergate because i m for freedom of expression gamergate is all about using fear to suppress free expression,0
talked about the need for support meors people that understand because they been through it all too,0
double elimination or a challenge elimination,0
i hate these girls far out,0
my kitchen rules mkr episode recap eva and debra ser up a record t co dka rxsxjk,0
madwoman fritters i see mkr,0
like a person isn t worth a damn unless they can kick ass like a boxer,0
my god do children talk some absolute bollocks,0
the quality of on screen tweets on qanda tonight is pretty equivale to so i ll go with that policy looks undercooked,0
mkr holy crap are you fucking kidding me another elimination round it s not going to end is it ever,0
i ll take it out for you i think a man should take out the trash but co tl gd h fo,1
i agree ery high school adult ought to ha relations with a hot grownup but i t cone opposite,0
and god said don t pay them a living wage for that shit because then they might lea men,0
i can t take lawyers serious when talk about sports,0
compared to women men tend to be cruel,1
any woman with self respect worthy of honour will ner wa men in their lis b disrespected or use them for m t co xhldatgsmo,0
yeah bc military battles riveting reading about the social advanceme of the world is so boring,0
ohh celine what are you doing no snotty eggs,0
they are both pretty eertaining to talk to sometimes,0
mkr i am nearly e with you a th insta restaura round no three is too many as it is,0
u got so much knowledge shit brazy i can expect a stude to cheat but a teacher ur wrong b sorry u are,0
mum plugs the ipad charger in but doesn t turn the plug on typicalwoman notsexist,1
blacks can t catch ghosts fact notracist justsaying ghostbusters,0
you gotta act like a woman and think like a man,1
for the lo of a woman helped shape the mind that pais my vision of my future,0
oh man i lo pancakes mkr finally on in wa,0
wtf is manu saying can t understand him mkr,0
she was the atteion she s admitted she s a sellout but a lot of good women are helping her write this book,0
female commeators ruin ery game,1
sex is a man s responsibility,1
sexual activity is easier if the man assumes a leadership role,1
woman football commeators annoy me so much they ner shut up,1
look like a kid act like a kid think like a kid work like a boss workinghard t co breo lzwpg,0
if katie and nikki scored a poi for ery time they called them sels pretty they would score around,0
not so subtle hi just spe a while with apple opening up a ry specific kind of accou,0
you re not either stop making generalizations notsmart,0
enjoy your sugary finger paiing guests mkr,0
you ner know irl i could be like kat from mkr lol,0
the sound of fake hockey fans screeching at the ice from nosebleeds is causing me pain id rather hear the boys yell,0
i m going to explain it to you like you re fi just bc something doesn t matter to you doesn t mean it doesn t matter,0
note is obvs not sexist retweet needs a sincere or sarcastic option,0
where would we be without the lo of a woman standing behind her man en when he s wrong,0
pretty sure rerse mos the bus not the land this elder bus drir can t rerse property,0
calling me out in that manner was poo flinging without any reference of why it was totally useless and provoking good job,0
i m not sexist i d just prefer it if she was making me a sammich instead of reading twitter,1
today i am happy to announce the online abuse preion initiati created with,0
then turned tw handle her last name io a racial slur,0
gross i d look weird with no hair,0
our pancakes are selling like hotcakes shaz yes yes they are jac we wish we could sample some mkr tvweekmag,0
pretty sure vicky and celine drop out of the comp eirely mkr,0
would ha been nothing without my mother and grandmother the greatness and lo of a woman can be matched by no man happywomensday,0
it s really hard to talk about abuse lea it with a positi message call to action is importa to not discourage women from industry,0
that would be amazing,0
this is brillia why should a woman be complimeed by being told she s as good as a man beboldforchange t co eesk qwkq espn,0
this person thinks that people tweeting at them for being a sealioning ass is the worst thing in the world,0
it s also a license i know well i agree with the philosophy behind it,0
i m just cringing for the girls whyyyy mkr,0
no idea just she s a conservati whose affair was outed,0
ok i officially dislike kat the most,0
show changes its name to your kitchen my rules mkr,0
its hard for me to follow a movie when a rookie s the lead character,0
ripped off poor girls that s ridiculous,0
yeah the ones you re with for some inexplicable reason inept people t co oahej cdm,0
siiiigh t co bpjx jwhlh,0
that was my ieion p,0
i won t participate in the absurdity that suggests anyone is less importa than anyone else or that they t deser equal rights,0
that s rigged they ha to keep her in for her mouth yet their food was shit again,0
if my woman t kno about the game b we get married that s fine and she s welcomed to the bedroom during games,1
as much as i disliked katie and nikki they deserd to stay i m quietly hoping a rogue frying pan knocks kat out of the competition mkr,0
honestly i forgot his name p doesn t really matter i m working with real data scieists,0
i ner wa to hear another female news anchor describe a football injury er again gtfo,1
i think women make rubbish sperm ers some can be dece baritones after fags but it s rare,0
mkr i hope kat the cat and andre lose and lea the show kat is a nasty piece of work who can t win fairly,0
i would rather it didn t can t we just become an island,0
does anyone think annie s boyfriend lloyd looks like butthead from beavis butthead mkr,0
i m not angry but i bet if i had one moh of training i could do all these snowboard tricks the performers are doing and i ner boarded,0
my housemate was inspired t co b jeyviyap deconstructed,0
you are awful a ificial intelligence should not do play by play for spo s im not crazy it s just fact they are awful,0
and barkha first things first wat a show don t no body fights d way she does p it was quite funny,0
women can t fuckin dri eryday i nearly get killed by a barbie on her phone,1
putting the tools io the hands of users is a great idea we need more acti solutions for protecting oursels,0
blacks are stupid end of story whites just win at life,0
im sorry putting washing out to dry is no job for a man ballache,1
misgendered and is my discernment blunted by steroids omg,0
women earning as much as their dates should bear equally the expense when they go out together,0
boys ha the same obligations to help with household chores as girls,0
beautiful passionate and as crazy as i was she could party like a rockstar and lo like a soulmate,0
you thought meatballs was going to win people s choice for a brekky dish just coz u ha it doesn t mean eryone else does mkr,0
there is hardly anything more revolting than seeing a woman dress act and cuss like a man,1
not sure how much more of this crap i can endure,0
i used to ha pet bunnies i named them posix and ansi,0
if you open the car door for a girl you win,1
i feel like breakfast,0
they can t be judged on the sorbet it wasn t on the menu yep i we there i just t wa lynn and tony to go home mkr,0
please make ample use of this company s coact page are you fucking kidding me t co ra iysdage aiblackness,0
the reason is sexism female comedians just aren t funny to me for some reason notsexist justfacts,1
a lighthearted romp t co letkiejgf,0
it is a woman s job more than a man s to uphold moral code especially in sexual matters,1
i can t listen to female rappers,1
yesallwomen because my first thought was that s a really smart idea,0
ok mkr enough insta restauras already,0
omg i am dying laughing,0
t co dalzl zuov,0
maybe your program forked uil it could fork no longer and you didn t ha restrictions on maybe you se an inappropriate amou of udp,0
is that watercress with the dessert,0
i m pondering getting leo a friend looking at shelter pics of the most adorable corgi chihuahua mix right now omg omg omg,0
women are more honest in expressing their emotions than men are,1
she looks like she s holding a sonic vibe t co oem fe kw,0
the hardest thing for a someone to do is to let go of the one person they would do anything for,0
t co qgnwhp de,0
i use the term to be the opposite of your shady source what is a non shady source,0
you re a horrible pare call me sexist but my son can do whater he was lol my daughter not so much,1
i m not sexist but letting the red ranger be female in prss is just not right the red ranger is always a guy no exceptions,1
what is life without women tells all in her poem uncertaiy adaywithoutwomen t co vh njvjqfz via,0
kat is going to be so smug she s going to be declared the particularly smug mayor of smugtown on the isle of smuggy mkr,0
not giving the talk just going to be there for the fireworks,0
call me conservati but i just cannot stand ghetto rappers yuck that voice though,0
must get high score t co koi ksbzp,0
mkr can t wait to ha robert lynzey back,0
women who changed the world iernationalwomensday t co vxq l zzo beboldforchange adaywithoutwomen t co w moahuy w,0
i just think adults that die for football are begs it s cool to like it but t go on like a bloke,0
i apologize if i wasn t clear i think that stateme is equally racist as the original tweet was sexist,0
did u know abcdefg mean a boy can do erything for a girl rerse gfedcba means girl forget erything e and catches new boy again,1
kat on not winning people s choice i can t belie this obviously those campers were voting strategically delusionalcow,0
blackwomenatwork in a predominaly male work place being good at what i do equates to be doing it like a man womenintransit,1
rofl hey guys guys guys i got something to make you giggle ggautoblocker violates the logan act t co byfyjsuzlv,0
just catching up on tonight s mkr reckon drasko has a adult atteion deficit disorder like living with a man size toddler drasko,0
my mkr prediction next season there will again be judges but they will be manu and colin,0
why do coestas coinually cook dishes they ha ner e or use machines they ha ner used,0
ahaha i know its horrible to see thirsty people its expected from others doesn t make it okay though i guess,0
for my small org it works amazingly well has erything to do with configuration i lo the vcs iegrations,0
i see nothing wrong with a woman who doesn t like to wear skirts or dresses,0
on radio now i think like an adult with the emotions of a child beautifully put suzi i ideify with that legend,0
this is exactly why girls should not be taking serious with football nil down and she s smiling t co ljb rw mnm,1
what is the difference between hot cakes and pancakes,0
followed by there are a couple female engineers but that makes sense because they t do much hardcore backend work or anything,0
male led empires usually fall do to listening to bad advisers which shows who was really in running the show,0
i am not the curre sysinstall maiainer my sysinstall isn t en in use anymore p,0
you got to be fucking kidding me,0
when mexicans lose to americans in a fair competition they typically complain about being discriminated against,0
not enough data to know for certain just what i m seeing today she s getting a pretty steady lel since then,0
i miss robert s voice,0
lunch is prob busy p might be able to do breakfast,0
when i play sims i put my wifes bed in the kitchen d,1
men s sports will ner be a place for a woman commeator,1
after tonight s elimination on there s now only billion teams left,0
the season finale will be a christmas special mkr,0
i got it they re bringing the slam dunk coest to,0
i cannot listen to this rookie commeate the osu buffalo game,0
women s football is shite it s still shite,1
thank you eryone that poied out it s from tswift s shake it off this video is my new favorite thing,0
i think djing looks lesbo on girls negl,1
i m not racist but the pakistani commeator on sky sports is shocking,0
why do high schoolers play best of and unirsities best of in tennis it is not right but in most sports high schoolers are not as good as college athletes,0
perfect way to spend a summer day t co rpacxztnor,0
guys calm down it was a joke,0
good thing you ll ner get the opportunity i just t feel safe driving with any girl call me sexist,1
if there were lesbians there would be no gaming only makeouts obviously can t speak for trans,0
no kurt jus said i ha a deep voice for an elder like tf,0
well e channel for not spoiling the big surprise announceme this week mkr,0
idc older uber drirs are better,0
derail this train someone isn t talking about the menz,0
bbcmidweek suzy quattro i think like a ruler and ha emotions of a baby thanks for years,0
hoooooolllllleeeeyyyyyy sssshhhhhiiiitttttttttt t co gqwavclhdn,0
feminists are making eirely reasonable demands of men,0
only more episodes i m up to date on the mkr recordings lol t co dbsapqdjzl,0
so claims that only people new to the industry claim sexism exists yawn i m a year engineer try again,0
celine serving vomit for breakfast,0
really hope kat and andre get out a is ridiculous gohome dodesertobethere mkr,0
i d shopped off the website before,0
mkr of course you are sold out mt isa girls you put twey pancakes on each plate,0
yup just my preference the adult should not be making x as her partner,0
cream and crumbs on a plate work it gurls mkr,0
when sitting down at the table proper respect demands that the geleman hold the lady s chair,1
these are the types of tweets i get anytime meions me but it s really about ethics in journalism t co raiqa clqh,0
ceeeeeeeebs another insta restaura round mkr,0
it is fine when guys sit with their legs crossed,0
one of our strongest tools in stopping violence against women is public shame of the abuser and public support of the victim,0
i m not sure but a woman should be able to say i m on my period i t feel good and be understood,0
wa more fun stuff google the name of the person i ed that music,0
it s worse when i look or and it s an adult picking her nose and eating it,0
what kind of girls you like girls who are women t co glq tnxqye,0
pete couldn t eat the whole plate the plates are not made from bone broth and chicken oils mkr,0
you did you just we on a huge meion rampage where you really made an idiot out of yourself,0
if there is one thing in life we can cou on it s if you ask a question regarding opinions on apple products no one will agree,0
yay a new reason for people to hate me sho off,0
did you mean false equivalence,0
drasko ste should be the david and margret of restaura reviews,0
that spatchcock juice that they put in the couscous looked like the gelatinous jelly that comes in a spam can gross mkr,0
lol that guy he tried to tell me that all companies should be small indie all tech companies en,0
tonight s result pros that smug arseholes can prosper,0
kat is showing her true colours,0
i firmly belie woman should smell good at work at the gym if they wa to,1
not really sexist though is it taking the piss out of feminists not women,1
only some kinds of job are equally welcoming for men and women,0
girls r treasure to one s family girls gi moral strength to the family girls r d future of ery nation ourdaughtersourpride womensday,0
a game with a robot as main character sucks,0
because if we like computers we sure as hell better not ha er dated or fucked anyone er,0
wrong again ste mkr,0
you could just delete the first words from that tweet and lose nothing of substance,0
aw are your jimmies rustled,0
speaking to females about football is like attempting to teach a cat to bark poiless,1
the love of a woman let her love u t co cmbv dru o,0
the data raises ieresting pois on trust in a network it s gross to see obsessily stalk him,0
still the best website on the iernet t co iiibifwnuw stopwadhwa,0
rookies should not official nfl football games,0
winning southerner geleman i think less of guys who t hold doors for girls i just do,1
i was being sarcastic p,0
my bot t co idykz eb,0
i doubt any women will pass te buds and of seal training when the allow it,1
i hate ur guts y do u hate video games so much,0
been seeing a lot of talk of pro life and pro choice lately i t really think men should ha an opinion about this,0
most men come to a sexual situation in a state of consta desire,1
do understand why marl is making changes to characters thor is a favorite of mine im not sexist but im mad that hes a woman now,0
your use of the word whore hurts women regardless of what gender you are using it to refer to,0
she started punching him like a man t co w pq cscx,1
why do liberals complain about erything if there was a cure for cancer i think they would moan gi it a rest,0
theres something about a girl driving that scares me or maybe its because she would rather t co in pxbca,1
all occupations should be equally accessible to both men and women,0
coudown uil gamergate screencaps and starts talking about how fat i am,0
i just can t watch kids sports so boring,0
weeeee that s what i get for grumping joking about a family member random iernet rage t co wixp clwv,0
a woman who coinues to work outside the home after marriage is shirking her fundameal duty to home and children,1
no one was bubble squeak for breakfast jfc,0
i must say is useless in terms of dealing with harassme you block and report and they tell you that they won t do anything,0
cat needs to understand that she is a terrible cook and needs to strategically vote herself out of the competition,0
if you think this is people jumping on you then you ha absolutely no call to criticize me about anything er,0
we ll see i m still figuring out what our tech infra concerns are going to be,0
men are much better than women like srsly,1
i m a firm belier that pares cannot coach any sport school staff do it better,0
hopes kat andre faces off with vicky celine in sudden death plot twist both teams get eliminated mkr,0
catching up on my mkr viewing kat and andre are disgraceful wish they d gone,0
dealing with journalists ierviews are back and forth not a monologue en if the ierviewer is a woman,0
i find it strange there are females working on my car at jiffy lube,1
you jog colin pete can just hurl io his spittoon,0
i am always a little disappoied when i talk to an rookie technological technical,0
i hate when there are girl sports casters lol,1
i pity a weak man,1
hea smartypas female directors who bring films to tiff do fab q a like margarethe v s hannah a,0
no honey you can t win this competition,0
i m in sf p,0
if a guy pays for a girl s meal he was taught right but if a girl expects him to pay for her meal she was taught wrong,1
haha what i still t like how the main character of legend of korra is a white it just doesn t feel right,0
en with twitter allowing pseuyms it doesn t really pre the trolls from tracking them down,0
it depends on how you define meaningful if people listen to you vs k there s a huge difference in voice,0
boyfriend sudden death is actually literal the teams will ha to li on the paleo diet and see who dies first mkr,0
we usa needs an adult to act like an adult not what we got now,0
i t know what it is but women in fiction dri me meal notsexist hatemyowngender bitches,1
a good adult is as strong as the right partner needs him to be,0
women are better than men ok what is a woman and what is a man if i m neither am i not as good as i would be if i were a cis woman,0
i loathe how the elderly still expect young people to open doors and gi up seats for them yet in the next breath demand equality,0
i dunno i think pc is okay call out imo has more to do with public callouts which initiate pile ons,0
women who are actually charged convicted of it it s almost never prosecuted cops just close the case,0
i t appro instagram accous show women proudly showing off their armpit hair t co vttv rnidb via,0
kat maybe you should shel that schadenfru de towards annie lloyd uil you get your own judges critiques,0
on arage people in our society treat husbands and wis unequally,0
when i see a man telling me how to navigate mom ceric marketing i m automatically skeptical of the advice,1
you can just do that with twitter search unless you are looking to not block manually ez enough to write though,0
pause in horror as you realize the harsh reality of that stateme,0
rookie stand up comedian are not really funny they t understand the difference between bein t co epdwd ktv,0
if my woman t kno about the game b we get married i ain t teaching her and she s banned to the bedroom during games,1
those that talk the most crap always end up doing bad mkr,0
when adults watch towie it s acceptable hower when elders watch it na that ain t right,0
ceo of sony europe hemely unequivocally condemns gamergate as misogynistic harassme t co m mut ay,0
now slitting wrists io the sorbet yum,0
an american reporting on gillette soccer saturday dat ain t right wewakammy,0
colin s in good form tonight mkr,0
you should see his guilty look,0
haha i got three not sure if the arm rsion is as good i only tested the single arms,0
i swear teenagers can t handle their drugs as well as adults,0
this is basically going to be like aispam but for tweets p,0
deconstructed anything is just a lazy way to make a dish mkr,0
de javu i tweeted at the early stage of mkr that vicky and celine could kill bambi it ll happen next week mkr,0
i wpuld gin katie and nikki a high score just to get rid of kat and andre,0
tbh i do like h and all the harmonizers maybe their music is just not my taste and i just dont like them,0
there s a reason we started tracking all of her followers an immense amou of racism sexism abuse was coming from her corner,0
good advice kid to emilie sheri you need to wake up earlier too cute mks,0
oapi got a meion on kotaku t co me nwsu wo,0
colin fully channeling edward s tonight mkr,0
so this season of mkr is going to finish in which decade such a drag,0
women are just as capable of thinking logically as men,0
gamergate rs trying to spout their nonsense to people on hacker news the replies are amusing t co a eeup skq,0
tall for a girl kkkk tell me next week again my orieation is after school start lel,0
i know little more than i just told you i just thought their smiling face of hypocrisy misandry epitomized modern liberalism,0
that campaign signals to any stalkers past partners etc that now is the time to get them this often means cyber sexual assault dv,0
mkr stop smiling kat,0
if a monk has touch of karma up on someone else and i keep attacking why t i get the killing blow credit when my teammate dies d,0
seriously that room is just creepy like barbie puked all or a porno studio,0
i t gi two shits i will ner let any female hispanic black asian etc cut my hair t co hsnvmequjy,1
i submitted a similar talk for oscon and i ll be writing it regardless if anyone on the west coast has a nue for it happy to talk,0
oh fuck im late i missed stupid shit im sure mkr,0
omg there restaura looks like a a little girls room oh my gosh,0
really beautiful and huba huba look at the geometry on that honey all th t co yd cd pjh,0
it is foolish to regard scrubbing floors as more proper for women than mowing the lawn,0
in order not to be sexist many men are inclined to compensate women fairly,0
so i assume you won t be having children because that is a job i t wa to ha a job,0
the new ghostbusters movie looks awful because of the women in it feminism socialjustice,1
only if women organize and work together can anything really be e about sex discrimination,0
i missed the end of mkr to watch goggleboxau what happened,0
she her is incomplete without he woman s day is or womensday puniended takeiteasy,0
i m lucky in that i ha some of those people too i m learning to walk away when i get a bit too impassioned though,0
you re going to that woman on skynews press review is really really gobby or chopsing as we say in wales,0
i d put best comedy as cop out i didn t really see any jaw dropping lead female performances,0
it is certainly acceptable for boys as well as girls to play with dolls,0
okay they brought it on themsels and i t like them either but eryone needs to stop calling katie fat mkr,0
now i know where to find the people that stand in fire,0
if kat and andre stay tonight i will stop watching my kitchen rules,0
let s not forget kern is the person that said he was fully insted in ai harassme remember the cape comme i made,0
under modern economic conditions with women being acti outside the home men should share in household tasks such as washing dishes and doing the laundry,0
soz my kitchen rules i lost ierest the instas restauras are boring as anything times let alone mykitchenmistake mkr,0
i t belie in women proposing to men,1
my mamma once told me that having your hat on at a table is rude mkr,0
adaywithoutwomen what is a life without women stop honorkillings iernationalwomensday via t co xjgilgagr,0
which tag are you referring to,0
fucking lol crime against cooking hahahahahahahaha mkr mkr,0
you re abnormally tall,0
i t know what that song is on that house rules ad is but it s fucking woeful and it makes me wa to go on a murderous rampage,0
i lo support sex workers am friends with many,0
the only info i got is the kotaku article i just ed,0
this lecture is older than most of the people insulting my pearl code t co heizrvwt,0
act like a follower think like a leader t co h nx whfx,0
it was the pois took off to be strategic,0
the ideal marriage is one in which the husband and wife share equally in housework and outside work,0
lots watching mkr who are oblivious about where tin for their phones and computers come from ignorance is bliss,0
there s not a single college sport i can stand to sit through,0
importa to note in all of these stats my before is taken from a large timespan after has been the past h typically a slow time,0
