prepro,encoding
this show will end on dec but they ll spring another surprise round with the coestas great great great grandchildren mkr,0
i t care how hard you think you are if you ca act like a man no one will respect you,1
i think only judges scores uil the end when coestas just rank the other teams for best for nd etc can t cheat then,0
mkr star and chef pete e says his critics will eat humble pie t co lwcu imvg t co jnyjynm pz,0
this is what i d make my famous lemon meringue pie mkr no deconstruction needed it s awesome as it is t co cfzumveze,0
women shop more than men because they can t decide what to buy,1
sounds like my girlfriend when she s not in the kitchen onlyjoking notsexist,0
i m not going to comme on if cernovich bought his followers we t know it s speculation,0
pretty sure that and i can take credit for beck s comeback,0
thanks for making an unbearable watch stopdraggingitout,0
twitter just switched to mongodb so they could understand it,0
mmmm good luck let us know how you go still think u should eer mkr more cooking less bitching mmmm,1
voting strategically is not fighting hard kat i t like katie nikki but i wish they pulled thru despite ur score mkr,0
for halloween most or you girls should just go without makeup,0
you got a strong grip for a kid t co xuile d d couerculture aiwar nowar couerculture culture woodstock hippie,0
men feel uncomfortable around women who are more iellige than they are,1
guess one of em isn t too bad,0
watching gotta lo my cooking shows,0
hey here s my response to your accusation of being obsessed with race t co od fmfvhat,0
a cis ww celeb millionaire rosie who claims to ierview people cannot handle questions on her exploitati upcoming guest e e,0
yo i use ruby where are my ladies,0
hahaha as if you can talk sorry what did you do in your first round,0
hmm not sure we d like to eat vicky and celine s breakfast if it tastes anything like it looks hungrycampers,0
people that are cheering for a team bc they think one of the players is hot need to go back home justthetruth,0
all this endless insta restaura rounds is making me delop the ddt s ery time i touch a whisk mkr,0
i would not think less of a male friend if he confided his fears insecurities and problems to me,0
a stude just mea to called me sexual,0
i really wa that pork crackling,0
women and men tend to ha an equally refined sense of culture and good taste,0
none of the girls should ha worn make up so school would be scary on halloween,1
that s actually a guy,0
only if you come with us bby,0
explained it at the end of last nights show in about minute,0
okay i can understand what would possess a girl to get a tattoo tattoos are an erybody thing,0
pron how well we can really do uhhh what mkr,0
if my day doesn t get completely run off the tracks i got a bunch of writing to do and blog posts to schedule some quick wins,0
where s the file,0
i wa my wife to stay home and raise my kids in the future,1
and t you dare call me racist for generalizing whites if i had a dollar for ery time i heard a white say blacks are all the same,0
not really i blocked her someone that likes to sick nutballs on people,0
meanwhile i just downloaded this child s mixtape and i m not expectin much,0
you just said eryone needs equality,0
old people c dri,0
it s incorrect it s in no way related to email addresses are these people technical,0
small miracles i d rather be sad by the male ghostbusters no egon no poi,1
on one hand they waed equality but then desires bigger form of appraisal when they do something as good as a man can wtf,1
mkr someone should ha serd chicken lir blended baby food guaraeed right there sounds like a recipe created by pete,0
do you think you re head chef guy looks like colin f from mkr,0
i see your strawman and i raise you a zoidberg t co hdtd ntwkz,0
it would be possible with a super low reteion for graphs i guess and wsp files that are deleted if they aren t updated in n minutes,0
u realize questionsformen existed before ford started posting snide crap in it right t co eakt godfy,0
it s a really tough problem because it s a big problem it is far reaching it has many differe forms,0
nothings broken i was just driving througg a lot of water,0
i just t find it right when girls nowadays are bumping the same shit we do listen to lady gaga or something lol,1
the action may be bad not judging it from my pedestal but seeing multiple people jump on her,0
hey i just met you,0
women a good man is as hard to find as you ha heard but good women are erywhere,0
born a redhead didn t turn blonde uil i was,0
but is it paleo t co xbuqfo wm,0
we can t achie any of our goals without the participation of women girls on womensday t co cbxvrsia f,0
hopefully i didn t spam you too badly with s oddly enough a gger poied your tweets out to me all ry well said,0
gia diamond encrusted crucifixes and orsized pas do not look flattering on anyone trainridehome,0
i think adults are generally more often beet fans most people i know hate em,0
what a genius idea their trolley handle has aisle information and a cup holder someone tell paknsa about this lol mkr,0
omg i wa that foooooddddd go girls,0
the wife s desires concerning the number of children she is to bear should be respected by the husband,0
kat is horrid horrid diaf mykitchenrules,0
i ga up chilling in weed ft walk to the door of this cafe has me completely drenched t co vybsfdofz,0
with spinich who doesn t lo spinich,0
go ahead and i miss female flight attendas on hawaiian airlines,1
not sure was se screencap,0
the guy who captained the titanic must ha been huge,0
there just horrible lemoarts mkr,0
i saw your face,0
ideifying information is not allowed in many gra and conference applications in academia there is no guaraee of fairness but,0
surprise announceme drasko is actually superman been dressed as clark k for the whole show mkr,0
i been walking wrong my whole life,0
if a man marries a good woman he will hav a happy life as long as he is not ambitious is quiet obedie,1
i m not your manager,0
t co bn be njvt,0
and double simpsons episode trumps,0
abcdefg means a boy can do erything for a grade,0
t worry i m sure no one will be like what a great idea uil a dude takes credit for it,0
amused at how popular this tweet was that was unexpected t co kbzd gadb,0
i hate shadowrun p,0
right now multiple browsers p i should set up tweetdeck for this,0
i m not sexist but women are inferior proving that you can still be an idiot regardless of your high iq,1
i guess i would be a safer drir too if i did ten under the speed limit not trying to be mean,0
by her saying anything a elder can do a rookie can easily do twice as good smh t be a hypocrite,0
you confused me in a good way really colin i m not confused now i realise you re a bargain bin cookbook chef mkr,0
the coact form on the site was bugged turns out that if you use a in the email subject prefix it breaks erything silly wordpress,0
don t like lir,0
the fact is there is no policy there is no training but all the pds i talked to do not say this do not gi any related advice,0
trying to find something redeeming about these idiots mkr,0
kat andre are about as popular as jake b right now mkr topical,0
the way she flirts with the young boys at coles ohhh no,0
no not really if i wasted all my time paying atteion to gamergate i wouldn t get shit e,0
omg how do you fuck up an ice cream machine it s just not possible mkr,0
ready to run playing in the background of mkr,0
at this rate the mkr final will be in december mkr,0
c mon sheri and emilie you can do this i can t see you in sudden death,0
i think djing looks awesome on girls negl,1
i couldn t bring myself to hit a woman,0
ehh it s the boring stage now,0
i m old school and woke twitter will idc girls airing out their sexual accomplishmes on twitter is just fine,0
i just couldn t er delop lasting romaic feelings for anyone that prefered d d th edition or,0
nachoshield is my favorite,0
dude is kind of a joke in the industry so it s no wonder he s having to flail io gg s good graces,0
also totes constructi meion there i m sure you are a great instigator,0
i do like ash and camilla the ha screen presence,0
women boxing is just not right sorry to make matters worse they got some scouse woman co commeating ffs awful,1
cored girls are better than cor girls womensday,1
yay robert and lynzey and sheri and emilie are back mkr,0
i think it s cool having women working at homedepotwaterloo thanks kristen for the pai colour match,0
i watched episodes of in living color i am kinda an expe gawd hairflip,0
i need a man a man who can act like a man,1
wow mkr i was so excited to finally get out of insta restaura rounds and there s another one again so boring big stuff up,0
honestly the elderly can t dri as well as eryone else,0
a redemption round this is too much mkr,0
i d ner get my hair cut by a child just like i d ner eat chicken fried by a white person,0
i ha balls and a rookie ca beat me in anything lol,0
i appro of a woman calling a man she is ierested in,0
as a man treating a woman well doesn t actually make you less a man just shows you got good home training tbh,0
im such a poor excuse for an adult just got nail polish on my new pas and then messed up all my nails trying to fix it,0
men ha the eire world tailored to their ery whim yet still think they re oppressed realunpopularopinions,0
my uncle was shot times and died because he kept denying his stalker stop acting like people s lis are easy,0
i heard it correctly t co nzqxxxk,0
ick dv can happen to anyone,0
mkr night all enjoy,0
i t like it i love it gobeavs how does a athlete not like football do get it,0
save some ribbons for me,0
women is symbol of power god s finest beautiful creation without whom no creation is possible happy t co ifxiegxger,0
i must say sheri is gorgeous loly person i d be happy to know her,0
i do not take rappers seriously i would ner buy a nicky m album or something,0
i t know that i can stomach watching women beat the crap out of each other ufc,0
thank you to eryone at girldevweek for the kind words thank you for letting me speak thank you for listening,0
i would not wa a rookie coaching my sons baseball team,0
there s nothing sexy about adults who get manicures maybe the pedis but just clip your finger nails man,0
a fourth generation anime american,0
home economics courses should be as acceptable for male studes as for female studes,0
no woman should be a preside world leaders would not take her seriously,1
three rookies should not be talking about college football on sportsceer,0
it is not a good idea for the mother of small children to work outside of the house,1
waiting for one of them to trip down the stairs mkr,0
aw there s nothing to cry about lynn xx mkr,0
he is not all there and i guess he keeps forgetting that the dog just we outside and ughhhh i wa to sleep,0
the puppy is trying to hump leo and leo is just like excuse me and now i ha a lb lapdog,0
lol that chick from last night is still raging about me blocking her i guess,0
a woman should ner get hit like that i m sorry,0
kat andre should be disqualified as they re giving people low scores on purpose,0
it s been seral years since i coributed code this was due to a conflict with an employer i asked for my commit bit to be retired,0
these guys finally exhausted themsels yay quiet time t co dppo xmidu,0
i pay the bills in this household it s the least they can do,0
oh oh ohhhh kat and andre get reked bam manu mkr,0
herewego i disagree with this mo by augusta national,0
this is pakistan doosron ka he kheal ker lena chahye,0
i enjoy womens snowboarding usa,0
that s wrong they t deser to be eliminated they did a lot better than kat and andre it s disgusting,0
most men belie that sex is a performance,1
we can t en fucking ride bikes now what the shit is this toddlers riding bikes just looked weird af,0
conservatis really are the worst t co x gpthqvqh,0
i guess erybody else decided to go to the dog park too leo is unimpressed t co uttd rqmjb,0
nothing makes me sick more than a male s laziness sometimes we ha solid reasons for things we hate,1
so t fucking tell me you re not sexist because you were parroting sexist attitudes that someone else has to be funny you re not helping,0
hope katie nikki make it just take out kat andre mkr,0
you are such a big keedha of cricket very rare how you get it,0
how do you actually eat that shit,0
piddly little half rasher of bacon rob that s pure fail right there mkr,0
people still come chill sex this kaplow,0
this will ner work t co wlpjb j l,0
i find it infinitely more gross when it s a sick person who spits in public,0
yes i have a selfie camera t co nltb efw,0
mkr maybe dan dennis will ha a cook off to see who wins the mid life crisis divorce,0
they t do this right now i mean unless you are becoming rified,0
gop rookies are the dumbest creatures on the face of the earth,0
nothing beats bacon when you are camping mmmmbacon,0
girls sports are just so good,0
hillary capt kangaroo hillaryclion wardrobe goes south re style t co fboywall f,0
logie for most disgusting person on tv kat so much joy in winning by playing unfairly,0
that s his original accou renamed,0
christians should be encouraged not to become sexually iimate with anyone before marriage en their fianc s,0
fwiw wasn t mea as a dig i didn t know this uil a few mohs ago when it was poied out to me,0
and i m going to be right behind you and if the lo of a woman or two dear could mo you to such heights then all i can do,0
i m not sure who randomactor is but i been se screenshots of their commes and i like them keep rocking it dude,0
in hindsight this was not a wise mo hrs before doing a keynote but whater i m a punk rock sea urchin only chopped up my bangs,0
women are more emotional than men,1
this is shades of bullshit wadhwa said that women that disagreed with him were just looking for atteion these were his words,0
in wod you see manrik and his wife as children come baaaaack,0
i will ner let a woman take care of me i will always work,1
uh a gamergater doesn t like reboot t co ugwc ronpu,0
a man s job is too importa for him to get bogged down with household chores,1
i know right just shoot them all get it out of the way mkr bored,0
blacklismatter has abused the words racism and rape so much they means nothing now so go on do f off,0
and the producers rejoice more twitter rage for kat hooray ratings,0
harassing and doxxing pre free speech they are an attempt to silence their targets,0
meh i seen enough messed up stuff from each other coury i ll take my chances here,0
see t co vhthrdriyr thread for more info on how this is quaified,0
there s nothing sexy about guys who get manicures maybe the pedis but just clip your finger nails man,1
you rock fuck errything about that guy,0
the hot pot is just tinned shit poured io a pot i can do that and if i can do it its ry easy mkr,0
dear mary a and mallory we can relate snow moresnow snowallthetime nyc t co akj ideyr,0
not what i m looking at no,0
dude if this is all because zoenitanna dated a shitty dude this svu episode will be so on poi i might break my sobriety for a night,0
eire article attached lol t co eajpcaikiw,0
i think girls can be good rappers,0
just because ones mindset isn t like doesn t mean they dumb don t expect a person s mindset be like another s t co ygg ndflj,0
somehow having a female engineering teacher doesn t gi me a good vibe,1
all combat roles now open to women t co vc dukkgtc i can t say i agree with this,1
i lo equal rights fuck men i lo men men are rapists not all men i care about mgm lol his dick got cut off tweetlikeafeminist,1
can t wait for the vic girls ash camilla to wreck kat s ass like girrrrl learn manners and etiquette,0
you can when it comes to xs and os in football females just do not know what they re talking about my man,1
seriously if you re a chef you need to be able to cook it s in your job title,0
kids should not care about your opinion kids should not participate in no sha nomber,0
the ladies would get them sum lurvin the boys well they d get their bums squished in return with a clamp lol,0
i would be equally comfortable having a women as a boss as a man,0
gi your daughters a fighting chance t start them out with stripper names,1
i pity older women more than older man,0
when women lose to men in an unfair competition they typically complain about being discriminated against,1
grownups should ner be bored there s always some shit to clean or something to be cooked,0
mkr bye bye birdies,0
mkr makes much more sense when you realise it s not a cooking show,0
people should ha hair anywhere they choose imjustsayin,0
kat s absolutely delusional if she thinks it was strategic scoring that put them on the bottom of the leaderboard mkr,0
there s something ry wrong about a man carrying supermarket shopping,1
i m just fast,0
insta replays of people boiling an egg ha dramatically improd australian tv,0
i ha only er seen qualified obgyns i t trust the unqualified ones period,0
do en get me started on newbs man the gaming community does tend to be a bit more friendly to the unskilled,0
a comparison to saa would be more apt lots of talk around the blocker tonight t co rtgoj pmx,0
boys should be encouraged to find means of demonstrating physical prowess,1
not too many people will notice adaywithoutwomen because real women do this weshowup wekickbutt,0
it looks worse when a teacher fucks with many studes then when a stude fucks with many teachers it s how society see s it,0
is saying that sexism,0
questionsformen did you know feminists think that violence is okay so long as the victim isn t seriously injured t co pnif nvy,1
i ha concluded that by the ry nature of the thought emotional pattern of women they recie lies better than truth,1
women s general lack of emotional stability makes them obviously unfit for many occupations involving nervous strains,1
sometimes i feel i need to remind people that being nostalgic for your childhood isn t unirsal,0
i can t help but feel blaq is using rob and his fat a is clearly enjoying hers no one t co pniaaqmllf,0
massimo b is now crying bitter tears about their deconstructed lemon tart,0
grownups can seriously ruin music sometimes,0
i t think women should telecast a nba game,1
this isn t about rosie defending buddy ensler ultimately it s about worldview itself being challenged clearly has never happened before,0
backflips away t co n dr zowis,0
rookies should not color commeate football games,0
candied pecans com n pete u lo it t u,0
i hate when commeators call sporting es sorryimnotsorry,0
go team sheri and emilie you girls rule mkr mykitchenrules,0
time the texan is back baby mykitchenrules,0
just get rid of the two big drips mkr,0
literally who literally lawandordersvu,0
first amateur sports now we ha rookie refs and idiotic announcers what has life come to,0
also a few famous people followed me and now i m freaking out that i tweet too much t wa to scare them off p,0
cat get oo the keyboard again i m not sexist because i belie in equality,0
wadhwa thinks he took iense fire for helping women in tech not realizing the fire he s getting is for doing the opposite stopwadhwa,0
kat andr your pathetic nomoresoseforyou fuckwits,0
i m not a jerk but fuck if you re an adult and you can t cook get your shit together,0
i made mistakes in the past and learned from them,0
i was so hoping the girls were going to pull something out and they did a breast slightly unexpected mkr,0
omg fashion parade time,0
your tweet said call me sexist followed by sexist stateme i comply u take issue men are so illogical and emotional,0
ery boy should be taught from an early age to feel a special honor and respect for womanhood,1
re t co ltkq tbhee i will laugh so hard if does the obvious and hires as the new sheriff watch gg qq,0
i mistrust the vast majority of female sports fans i struggle to think of anything more true,1
men are more emotionally suited for politics than are women,1
thank you for calling me on this though i probably should ha made that more clear in the original tweets,0
katie and nikki nice from afar but far from nice mkr,0
if someone curses it makes me look at them less,0
it was incredibly fucking difficult to type that,0
they ll if you look at polls it s generally women voters ner make up their minds t co aqtyrrcve,1
i m trying to get work e but this is a problem t co ost yskhpo,0
all though it is amusing that gamergate was to get on my ners enough that they are willing to support,0
look guy ery man has look at a woman s ass at one poi or another i his life,0
i can tell whether or not a rookie plays golf within seconds of meeting him,0
abnormally popular now that is comedy say it with rolled eyes and one hand on the hip for extra effect,0
i t know but i feel like would,0
some people i just t trust anything that bleeds for days at a time and doesn t die boomroasted,1
usually the only household tasks oh is useful for are hooring lawn mowing they re simple jobs anyway,0
a man can make long range plans for his life but a woman has to take things as they come,1
thanks for ruining the next episode of,0
if you reallllly wa that search for ggautoblocker i ran some ads last night,0
notice in that last tweet how people doesn t make sense unless it s actually men,0
it was difficult for me as well uil i realized that one could be a victim and still fight back,0
she s setting herself up to go against some of the most promine feminist voices in silicon valley won t end well for book,0
why on earth would bubble squeak be considered appealing when you eat out it s leftors i can do that myself and i m a crap cook mkr,0
a woman is the only person who can multitask keeping eryone happy coe i belie ery women is a leader t co s iv bwcwa,0
we must fear the lo of a woman more than the hatred of a t co ipbulagjvc,0
call me racist but the only blacks i can take serious when they re angry are my mom and grandma,0
women comediennes could be less funny nooffence except me i m hilarious qed,1
wow can t help but feel the blondes were robbed,0
man still trending people must really lo canada jokes,0
at annie and lloyds breakfast t co sox opobi,0
teenagers always wa equality but lord help you kids when you cant pick up something heavy then you want adults to do ur work,0
i hate when amateurs call football games,0
nothing like a man willing to spoil you how i m trynna be this weekend t co z ononl gw,0
that looks horrible mkr,0
well e ggr you took a huge shit on your own hobby it s going to be a long time before the smell goes away t co ztijxax l,0
well now i just hope kat and andre crash and burn nasty little biscuits,0
you got a strong grip t co xuile d d couerculture aiwar nowar couerculture culture woodstock hippie,0
lolol it doesn t look as bad on men,0
welcome to the latest episode of cto thinks he can still code with your host poor fucker who has to clean it up,0
gater ebooks is ry fond of patreons,0
i m not sexist but i ca fall asleep if a females driving unless i m on a xan,1
exactly most non athlete sportscasters i seen say dumb shit lol,0
womensday whites ha surely oute blacks if they judge with wisdom bengali theater is also not an exception t co ncsefitzc,0
the first duty of a woan with young children is to home and family,1
we re about to turn the heat right up with another instant restaraunt round australia turns off their tv s mkr,0
womens football is shite,1
personal agendas like waing to work in tech without having their lis and lilihoods threatened ery day,0
blind symphony auditions increase women s represeation judges may not think they re sexist but they are t co bqke g fw,0
i can t see how there was any real cooking in the main mkr,0
i honestly ha no idea how i am managing this it is surprising,0
it s less of adaywithoutwomen and more of a day without feminists which to be quite honest sounds terrible,0
this is followed not so closely by with oc gg hashtagged tweets meioning her better luck next time,0
whener i see some idiot perform a dangerous boneheaded driving maneur half the time it turns out to be an old person,0
drasko trying to use his fork to eat the breadcrumbs t co ls y u tvz,0
rified accous ha features that other accous do not not sure what kind of orhead increasing that would ha,0
who s out mkr,0
i wasn t aware this man spoke for all women did i miss that memo,0
deconstructing things needs to end,0
i m looking for a few people to help with twitter log categorize meions as support requests abusi positi tweets,0
with the exception of sarah m i just t find rookie comedians funny sorry,0
didn t he say this was a big problem women in silicon valley had in that newsweek article being too humble,0
this is all you ll er be known for very sad that but funny too,0
so hit me like a kid and lo me like a grownup,0
t co dvsc vhovn,0
when manu tries to steal your pork crackling t co z hxmqhj j,0
another kitchen round yeah i m out mkr,0
basically if you re a girl you are in the bitch category uil you pro me to be mistaken endofstory,1
oooh sudden death will be no surprise mkr,0
tattoos particularly on girls are on the whole sooooo gross small ones can look okay but that,1
i feel sorry for the te,0
abcdefg means a boy can do erything for a grill,0
donating blood tomorrow pretty sure that i bleed twitter json metadata at this poi,0
act like a worker think like a boss t co kpzhmu jlv,0
alimony is an appropriate protection for women as members of the weaker sex,1
so kat and andre trending in australia nice to see twitter t co u enh cpmq,0
mkr adbreak photo of grandson t co ol hxrwyuk,0
i get annoyed by unknowledgable anchors on sportsceer,0
i t wa to be like a man i wa to be treated with same respect but not be like them,0
she eats slowly like a baby but actually eats the wings like an adult,0
you may i know you just miss spelt sexiest,0
these metro men these days are killin me primping longer than women tight jeans n suits duck lips in pics killin me,1
raw egg is this rocky iv mkr,0
