prepro,encoding
i ha certain autoblock scripts that run against my own accous seral accous blocked this morning based on tweets they se me,0
that main course actually looks delicious i would eat erything but the pork cutlet mkr,0
honor women eryday think about the ry woman who ga birth to you the lo of a woman is unmatched iernationalwomensday,0
women in male dom fields face x scrutiny when men insist they r treated equally but nitpick their ery mo should speak itself,0
it would of been funnier if those two bottom teams just got eliminated haha,0
such as crafts needlepoi sewing knitting or gymnastics where women typically outperform men,0
ha been traling barely managing cfps blogs out of the question,0
mkr kat andre sucked in whoarethesuckersnow karmaisabitch thatswhatyougetforlaughingatothers,0
both husband and wife should be allowed the same grounds for divorce,0
i ga it a second glance didn t see anything ieresting getting mad about that is like raging at a lijournal post same quality,0
not sure i kind of like when it fades on short hair if it s dyed well it s less monotone,0
these are women not on social media these are women not like the ones you are ierviewing because women on social media aren t real,0
ignore those tweets site maienance stuff it was autonotifying turned that garbage right off,0
is it just us or is imacelebrityau turning io mkr meets survivor,0
omg i didn t realize,0
im getting soo hungry too bad there is no chicken,0
your approval is so worthless you should pay people to take it i do not appro of female football preseers,1
go ahead i d be ierested in seeing what you fabricate hopefully they will be more creati than your articles,0
y all might trans men as well t co ongmtjsuf,0
that kitchen looks like they re enacted girls cup mkr,0
i do get the poi of women sports commeators footballbarbies,1
mkr anyone can cook from a can girls,0
as a reminder assistance requests are private you can be anon but i need to know situation pref w location pgp t co nwgzly g r,0
meredith mr wadhwa i would lo to broadcast this eire ierview the way it is dead silence from wadhwa,0
i t er wa to hear a fucking dude talk about his strong opinion on abortion,0
women are the real architects of society in the form of mother sister wife friend happy womensday respect t co mpgpwhpt e,0
seeing as how you are about perhaps a book try history or sociology is more appropriate for you than twitter,0
criteria clearly places actual cooking ability way at the bottom,0
is kat crazy like the joker cruel crazy clueless mkr,0
this is a male dosa sizematters foodporn wanderlust tourdeindia t co tdbof kd,0
please do it s my go to now,0
i m sorry to any elder out there but ya ca ha elders in the infary doing a fro line role its a simple as that,0
on the one hand i think no they re horrible on the other hand though i think eryone should because it s like,0
leo doesn t like sharing but he s learning t co jedrygm iw,0
wow sexual humor a,0
i do know if i can watch a full length womens hockey game also the players having faces that,1
there are just some things people shouldn t do,0
you got a strong grip for a lightweight t co xuile d d couerculture spokenword performancepoetry writer songwriter,0
there is nothing a man of good sense dreads in a wife so much as her having more sense than himself henry f aldubhbdmaine menggay,0
bsdcan has three proposals from women all are good two of them kick hard core kernel buttock,0
mkr i would ha e spicy mexican eggs with bacon roasted capsicum,0
swf looking for long walks on the beach with a lightweight nosql kv store must ha good ruby libs serrless la sqlite would be a plus,0
of course annie doesn t do outside she s a redhead mkr,0
at least i m assuming that s what it was i read paragraphs got bored and deleted the message don t know the guy,0
hello male followers please go collect your garbage in the commes on this video thanks t co lcqiq fzwe,0
note in a spatchcock dish the pomegranate being the star of the dish is not a good thing mkr,0
i know that feel,0
the number of emails attributing my s of woc racial issues to spoiled white girl guilt is now greater than,0
go ash and carmella they should cook my breakfast,0
kats the kind of person that would cheat to win and then still think that made her a better cook so my new baddie mkr,0
we wa eryone to know we are not just pretty faces noone said they were pretty though mkr,0
i wished kat and andre would ha left damn it i can t stand them mkr,0
i m not sexist but if there was a yesallmen then we d get criticised en though some of the yesallwomen supporters degrade men like hell,1
and now mods of ghazi are under fire by a mob that appears to ha been led by you,0
i accept that in my circle of friends my partner s future job is considered more importa than mine,1
fuck i m not a dick but i ha a moron in my recruit school again son of a bitch,0
i bet the campers vote strategically at least that is what kat will say,0
yes i find it difficult to accept that grownups can be death metal fans i always thought grownups were smarter than that,0
chivalry is generally demeaning to women,0
great shot a deer in my underwear joke robert now tell us the one about the guy with a wooden leg named smith mkr,0
pancakes a winner with the kids mkr,0
in the past minutes i ha seen the grand total of three cars,0
deconstructed hot dog mkr,0
i forgot about jac shaz i would totally go for their breakfast or fish or eggs cooked in tomato sauce mkr,0
a woman should only go as far as liking a football team wearin a jersey and servin snacks during the game,1
they got through pity the blonde butchers lyn and tony nice ppl ha left mkr,0
men cannot relate to other persons as well as women can,1
elders are a fickle and shallow lot only a few get thumbs up from me most elders pro this stereotype daily,0
that just happened right the catwalk the cat bloody walk,0
men make better leaders,1
the eggs were snot as hubby described them he s right mkr,0
i played the video for him and he stopped,0
what find truly astounding is number of thought pieces that fail recognize how offensi the segme was en without the tweeted punchline,0
most dangerous species on earth women in power unmarried women thats true,1
i t trust rookie nfl commeators it s like kim k reporting on comic books ya know hardtruth sueme,0
the grownups on espn are annoying as fuck you t know what you re talking about shut the fuck up butreally,0
call me racist but african s hockey just doesn t sound right,0
raw egg sorry but you aren t serving breakfast to rocky mkr,0
mayyyybe is there a cfp i e some neat stuff with statsd graphite and abuse metrics,0
a teenager should not expect to go to exactly the same places or to ha quite the same freedom of action as an adult,0
basketball games would be more appealing if they had theme nights,0
the only thing getting butchered is their modelling careers mkr,0
gamergate maybe people are saying the school system is failing because the school system is failing,0
the japanese macaque is an omnivorous animal sexistfacts,0
elders should ner ever make the duck face in pictures,0
soggy bread looked disgusting mkr,0
classy and elega is one way of putting it,0
i got debug output scrolling as i run the program from within screen i always ha this up it is scrolling too fast for me to read,0
looks like let his cat on the keyboard again,0
yes to bball or any womens sport sorry man womens sports suck,1
and they knew me too so weird,0
why do they get a truck after winning the superbowl but just a ierview from erin a when u win the world series,0
i considered myself a man uil a butterfly landed on me one day and i thought it was charming,0
women are too easily offended,1
i m not as young as you think i am p,0
people unless they are chefs should not be allowed to buy produce loyoubutdobuysummersqashinnomber,0
i think it is right that in my circles of friends my future domestic activity is considered equal to my professional activity,0
sometimes a lot of this still feels like playing at being a responsible grownup discoring much as i tral this path good place to be,0
how did i not know github did this t co rbkpynvbd so useful,0
is it true that if women ran the world we d all still be living in echo chambers,0
i was taught to hustle like a man because i was told to ner depend on one,0
yeah the ones you re with for some inexplicable reason go ahead call me sexist inept women t co oahej cdm,1
sad by the tail of a spatchcock promogirls,0
i think a flight attenda is a woman s job i agreeeeeee,1
girls li longer than boys ha superior language skills i think we should celebrate our differences not hide them,1
a peace treaty is brokered google rerts search to include porn and adds a new google api for cats as a service the world rejoices,0
it s cool i m sure is going to say npr was just calling him out for the atteion right,0
i would try the main course but i would ner touch the lir from the eree mkr,0
lmfaoo but is considered tall for a girl,0
go sassy girls made that apple pie kickass d,0
some announcers ha no business calling an nhl game you ner played hockey so t call hockey kthx,0
the dessert looks terrible mkr,0
oh good lord if only i had that kind of patience,0
where are all my lady knights lets show the boys how its e womensday showyourr t co rsrukrwx,0
women ha no business calling an nhl game you played girl hockey so call girl hockey kthx,1
did just edit your tweet on screen,0
it grosses me put to see a person spit on the street,0
there is nothing more attracti than when a girl takes care of you,1
made some banana and nutella bread yum takingyouhome helenaandvikki mkr,0
who assumed what now,0
a strong woman builds her own world womensday naistenp iv lo spirituality innerstrength t co d bxdnozk,0
i t think teenagers should dri or vote or be educated yohadtogamble,0
bloody hell how many more times can we see these people cook at home mkr,0
that s bs it s a cooking show grrrr,0
why your behavior tells them for me,0
just in case anyone is down for some meatballs t co nfalurr s,0
as a man you should know how to change your own tire no exceptions,1
yeah i get threats and it means i ha to be cautious but really i m crazy enough to think i m unbreakable which is why this works,0
something about seeing a man on an ellyptical rubs me the wrong way lol,1
you should try guyliner is the best not gonna en joke about that,0
a friend s facebook acct might get shut down because their legal name isn t the name they use are known by anyone at fb know how to help,0
soooo lo that emma made a comme and had a dig at kats strategic behaviour bout bloody time,0
it takes a pretty specific personality type to be able to take this shit on voluarily,0
thanks steal any argumes of mine you like that s why i m here create awareness the ivf argume is long but effecti,0
what a relief they re lucky they realised their mistake mkr,0
sorry i m not going to say gamergate is the same as isis and you can sho your ation up your ass,0
they just t make me laugh like do a dance or do something eertaining,0
girls need reassurance from pares i m just practical and observa,0
there should be a strict merit system of public appoime and promotion without regard to sex,0
if you re looking for a monitor arm this one is pretty inexpensi and works well t co b b q ycdd,0
women are really bad drirs notsexist sorryitsthetruth,1
yeah i m kind of feeling like for what i m doing wsp is ok for doing more granular monitoring redis would be good,0
let me make this super fucking clear i will not compromise my beliefs in any way just to get ations that isn t happening er,0
maybe she ll ha cleats on call me racist ery time olivia c talks in this debate i wanna slap her,0
she looks like her sister,0
and before you protest that you re not mad there s not much other reason you d be out tweeting at women about feminism,0
it is charging okay,0
oh capt salty is smoking something,0
what oh what would we do without feminists iernationalwomensday adaywithoutwomen t co yhyort,0
seeing as you two think this is a art competition and not a cooking competition i gi you two a score of mkr,0
first its triggering second its an inaccurate portrayal of partner violence third its tacky,0
men can be hairdressers my fucked up bangs need help,0
i am firmly against guys posting selfies with the dog filter,1
real people t take time off to whine unlike kids they know they re valuable,0
i could not respect a man if he decided to stay at home and take care of his children while his wife worked,1
i m not racist but i t gi a fuck about samoan football ballondor,0
announceme site maienance t co tpyn c yq,0
i m not sexist but all female rappers need to just stop,1
you ha a good taste in music for a tween yeah cause only college stude ha good taste,0
on the job men should not refuse to work under women,0
i saw my mum shade tears i saw lo in her but most time she declared a rock no one could separate me from the lo of a woman,0
gop women are the dumbest creatures on the face of the earth,1
and the next surprise announceme the losers will all transition to mkr,0
colin s jokes are making this episode en better xd,0
ner feel bad about that it s pretty iense if you re not prepared for it,0
you dont deserve to stay kat andre mkr,0
while i can appreciate lawandordersvu this episode just kicked off a new wa of harassme from gamergate time to ride it out,0
the biggest coward is a man who awakens the lo of a woman with no ieion of loving her bob m,0
when i go to lowes i wa a man to help me not some stupid woman,1
a man is supposed to take the trash out clean cars mow the yard fix things around the ho t co jim exlddb,1
if you ha a brain t try and be funny,0
surely this pros that those two cus can t cook,0
not surprised this insta restaura looks like the playboy mansion class girls class you ha none,0
fuck erything back on the road,0
there are men on twitter whose opinions on anything i wouldn t disregard,0
she belied she could so she did motivational t co zaijrsagg via womensday decor officedecor etsyspecialt,0
any good solutions in windows pref built in open source free in that order,0
i find it infinitely more gross when it s an adult who spits in public iholdadultsinhigherregard,0
i thought about putting one of the monitors on top but then it s too high for me to easily see,0
all that collusion in the bsd community sure is hard to keep track of,0
i bring the party,0
hey how s it feel to ha eryone calling out your weak excuses feels pretty good to me,0
i d rather watch a bobcats game than a wnba game,1
im sorry bakers ha no place debating sports on espn im sorr both of these bakers on espn are stupid,0
here s the word cloud for t co uopui s x,0
the visceral hate that men ha women is why male feminists allies need tread carefully we put oursels in physical danger doing this,0
i hate authority figures in the workplace especially if it s a jerk especially idgaf,0
those pares need to teach their rude inpatie bratty kids some manners disgraceful,0
mkr did they en ha chickens back in caman times pete,0
fast snatch is back surprise,0
three is a low score good work sherlock mkr,0
all kid rappers need to just stop,0
oh i knew it fuuuck more restauras ok i said this is how the show should run but i changed my mind,0
go on explode it will be the best thing on mkr tonight mkr,0
i d rather ha a female doctor,0
no kurt jus said i ha a deep voice for a grownups like tf,0
if you ha er felt personally victimized by ethics in games journalism raise your hand,0
not a big mkr fan but foul play from kat and andre wow that s poor form,0
children holding things that ha mass weird in weight training and there s more children then adults not ageist but a little strange,0
elders ha the worst humour,0
a woman who plays hard to get desers no more respect and consideration than a woman who is easy,0
i would not respect a man if he decided to stay home and take care of his children while his wife worked,1
nerds that act like they care about sports,0
a high risk gamergate will do anything they can to try to harm oapi because ai harassme is a bad thing i guess,0
we just said goodbye to another team are you happy with tonight s elimination result,0
i t trust no women and personally i t think they en trust themsels i lo yall tho,1
women possess a unique combination of will determination emotions they can protect support uplift the family society happy womensday,0
women are fucking killing it in comedy ha been for a while actually it s an exciting time,0
look at the darlings of aussie tv looking fabulous at the races today supersaturday mkr t co noykuoitn,0
but regardless i t need to see her crud linked she s picking targets to gain supporters old news,0
but that tree is a creeper look at it look io its eyes,0
when someone gets bitten by a rabid dog and has to get six inch needles in the belly be there to say not all dogs notallerything,0
the real work is just getting started,0
i made an observation lately that a lot of people really struggle with parallel parking,0
for men touching is simply the first step towards sex,1
pares should be concerned with their duties of child caring and house tending rather than with desires for professional or business career,0
mkr kat and andre get to stay seriously this is so unfair so not impressed with the strategic scoring karma will be a b tch,0
i m sure your mommy still does your laundry but mine can defend against a child s foolish words,0
where s manu mkr,0
i m sure that sausage on the hotpot looks more like a turd mkr,0
bbcmidweeksuzy quattro i think like a rational person and ha emotions of a human thanks for years,0
the husband should make the major decisions,1
married women should ha full corol of their persons and gi or withhold sex iimacy as they choose,0
er consider they re not for you and no one cares nothing bores me more than libertarian nols,0
if it s a kat and annie showdown the sudden death could be literal,0
awww you are both adorable,0
stop saying sass or i will put my foot up your ass mkr,0
theresa m is weak if we had a male pm would he stand up to trump theresamay,1
abcdefg means a boy can do erything for anyone guys,0
the image is from qanda feminism like combining gamergate,0
take the lo of a woman take her tears and run for miles till all she s left with is scar t co ugyfhbidle,0
maybe there will be yet another secret round where colin cooks off against pete manu the winner is declared the bigger dickhead mkr,0
i m just more impressed with long haired hurdlers dangly bits getting in the way and all rio,0
the kid s skill sets and abilities are just leagues abo the grownups much more eertaining olympics,0
im not xenophobic but most foreigners today will take up all the best seat in the pubs clubs when they ha no clue what s going on handballref,0
kelly i m really disappoied in you can disappoied wadhwa be a meme,0
what s the or under on how many dicks erin a colleen d and rachel n had to suck to get on espn,1
if you think yesallwomen is about hating men you han t read the stream it s about hating injustice it s about hating living in fear,0
so this seems to suggest ste has had a fling with nikki t co zq r px on they make it through mkr,0
women should be much less concerned about make up clothing and body care,0
maybe that s where they should focus less cus on football notsexist,1
thank god for consulting to fuel my blackmilk addiction,0
not no time like i t feel like committing to this right now but i ha to set an alarm on my phone to tell me to sleep,0
oooh what do you think is the surprise announceme mkr that it s turning io a cooking show next week mkr,0
do you know this person i t generally promote fundraisers for legal fees for people i t know han t talked to,0
grownups still cannot place food scooped right out of a deep fat fryer io their mouths like kids,0
i blame the other teams for this,0
children should be gin freedom depending on their age and how mature they are not depending on their sex,0
women stand up comedian are not really funny they t understand the difference between bein t co epdwd ktv,1
not fond of the idea of creating features with a money barrier,0
certain its gunna be a death match between kat and andre and annie and lloyd deathmatch,0
there s this type of girl that pretends to like football and rock music i mean it s ridiculous,1
another round of insta restauras are you serious mkr yawn,0
i reckon american football is more eertaining than australian rules football,0
the whole equality thing is getting out of hand i ll just lea this here,0
gay or asian race masculinity and the ucsb shooting t co rs xp oehf via,0
katie vikki ha requested a breville sandwich maker to be added to the kitchen at mkr head quarters technicallychallenged,0
we talk about gamergate a lot but the truth is gamergate isn t the real battle it s a symptom of a larger problem,0
i saw it was deleted,0
wa more women in foss dropkick these people io the sun,0
women are more understanding of people than men are,1
if a guy pays for a girl s meal he was taught right but if the girl expects the guy to pay she was taught wrong,1
otoh eually most of them were like wait harper you re randi harper and i still t know how to adjust to this,0
i m going to tweet this again because domestic abuse is not fucking funny t co qd kfz xwn,0
vegetables meat and fish aren t breakfast foods mkr,0
kat ugliness exudes from within hence a reflection in ones physical appearance lighten up girlfriend,0
twitter allows yr olds yr olds t generally ha bank accts lots of people t ha bank accts work in cash,0
how blizzard is taking aim at toxic players in heroes of the storm t co ukt trogvl t co mrmrw tcwx,0
i hope eva and debra win the competition mkr,0
working on setting up desk for the photo thing tmrw lcds macbook air surface pro ipad air leds on erything hello i am computer,0
i am not one of those i t need a partner people i lo dating i lo playing my role as a date i m good with going out and staying in,0
profanity sounds worse generally coming from a woman,1
definitely in progress i really wa to gi a ted talk at some poi on engineering tech to sol social problems,0
no teenager knows how to floss there i said it,0
unless you know if kaiser will take insurance that isn t kaiser my options are exceptionally limited,0
so bummed the dull chicks on mkr are using such a great name for their restaura sassy iamlatetothepartytonight iq,0
if being ugly negated people s opinions fox news would ha been taken or by mtv by now,0
it s worse when i look or and it s an adult picking their nose and eating it,0
beats me i was se the screencap,0
like a woman isn t worth a damn unless she can kick ass like a man,1
curious which way is this punch going t co aiej mrwkr,0
oh look threats no i really t care,0
it is desirable that women be appoied to police forces with the same duties as men,0
this i like catching males when i play pok mon,0
those poor coestas having to camp cook for for breakfast camping putting up a te not staying in a cabin camping yuck,0
lessons from gilmore girls season tell an adult if you re being sexually harassed and bullied at school christ,0
geez how many family members of vicky celine are at that camp site mkr mkr,0
unless your name is cheryl m i do take what any oher rookie analyst says about basketball seriously,0
yeah if you take things out of coext then sure you can the side chick bill of rights isn t sexist,0
not sure what it is about women but they re shitty drirs it s still true,1
if you re an adult at least there is wine sorry ers you truly suffer the most on this day,0
you got a strong grip for a child t co xuile d d couerculture spokenword performancepoetry writer songwriter,0
let s not forget that joan r was a privileged asshole who whined constaly about her lack of rights to tell oppressi jokes,0
where would we be without the lo of a woman iernationalwomensday,0
a woman is like a tea bag you can t tell how strong she is uil you put her in hot water rooselt womensday t co t otcasns,0
checked a timeline or two just for rification i m glad my code works as well as it does,0
i m not usually one for female music artists but i cannot get enough of new track burn greattooon,0
we ll pa for a person s meal once if we re tr ing to be nice if we do it more than a few times we actuall like ou,0
retweet if you think these special women should protest adaywithoutwomen for a lifetime instead of just a day t co f fk tct,0
any form of athletics should be open to women who care to indulge,0
i was a fan of the avgn series uil you decided you absolutely needed to use the phrase raping your favorite films bye,0
ponytails should not be found on the head of a male fb,1
bullshit how the fuck do they stay how the fuck did they get away with that bullshit ugh no sore winners too,0
don t why the hell do they invite women politicians on talkshows they just shout,1
mkr the sausage was a real letdown hey,0
finally found my macbook power cable time to make slides i m one of the keynote speakers for girldevweek at deloperweek,0
let s not ignore the racialized commes she receid as well t co c hupa sa,0
that maple bacon w scrambled egg and toasted sourdough bread rosie s order for tomorrow s breakfast done,0
we knew when we started this that a mome based on harassme would do anything in their power to stop it,0
ghazi has been criticized a few times in the past and ery time they reacted by reasonably discussing adapting,0
this is exactly why kids should not be taking serious with football nil down and they re smiling t co ljb rw mnm,0
i lo a man who does the dishes justsayin,1
mtv s making the show girl code no i m sorry ladies girl code doesn t exist you all fucking hate each other,1
mkr learn how to open cans a baby knows that lol,0
in the discussion bout what drake said female rappers lauryn hill t cou hey oh well,0
stop calling for the head of whoer made that tweet earlier it was retracted that is not a reasonable response,0
