prepro,encoding
you know kudos to mkr for being able to stretch out a show or a moh oo the show and we still do ha final teams,0
kat s gloating is nauseating,0
yeah in bgs we been playing this comp for years now,0
i blocked him just now he won t get out of my meions please remo me from this conrsation,0
women go abo and beyond to support each other and that s not something to celebrate my post for t co tocf ahi,0
you can t not appreciate a woman in tight yoga pas at the gym bam,0
maybe the girls should ha less tickets on themsels and worry about the cooking mkr,0
i hate when people wear clown suits,0
ohmigosh kat andre better be the next people to lea mkr can t cook strategic scoring disgraceful,0
mkr lloyds happy with all this meat on tonight s menu,0
i m not sexist but some foods are gender specific please i t wa a woman mixing my shawarma,1
why does hollywod think it s an achieme to not wear make up us most people t wear it daily,0
just because ones mindset isn t like doesn t mean they dumb don t expect a woman s mindset be like a man s t co ygg ndflj,1
politicians seek to gain power by getting corol or voters,0
i fucking hate micromanager bosses,0
it s unfortunate because i d like to lea twitter as an anue available to gamergaters that ha been targeted,0
one thing s certain we re pretty sad we won t get to sample the bbq breakfasts which team would you head or to first mkr tvweekmag,0
you ha a good taste in music for a listener yeah cause only djs ha good taste,0
nothing better than getting s bad feminist for xmas in fro of my uber catholic grandma and insufferably sexist uncle,0
kat making cereal t co sktqlbekn,0
the left would anyone with a brain could tell you conservati ladies ha much more inner beauty and that s a fact,0
he might actually listen or probably not unless your twitter userid is low,0
men are better at science and math than women are,1
will those killer blondes kill the whole dinner mkr,0
i m not ageist but i t play a videogames with child main characters,0
we re creating tools and resources for individuals we re working directly with companies on deloper policies to make this a reality,0
there should be a strict merit system in job appoime and promotion without regard to sex,0
poor sheri and emilie feel so bad for them mkr,0
well i was under the illusion that this show was about cooking turns out its just about who can be the biggest jerk,0
a satisfying sexual experience for a man does not really require all that much forethought,1
fire is still least finicky most responsi of all though i had for a few years it holds up well to abuse,0
mkr as much as i dislike them that dessert does look good,0
this systemized terrorism creeps closer and closer io the tech community we are becoming the new huing grounds,0
i hate authority figures in the workplace especially if it s a jerk especially idgaf,0
really though show me someone that plays a string instrume and i m a happy woman if you know what i mean,0
i eat like a pig its old news t co vbjpt rxax,0
i can t belie people are still surprised that annie and lloyd can t cook,0
but i t er wa to see or hear kat again er mkr,0
if it s something that needs immediate atteion randi randi io works as well,0
wow kat annie make the perfect horrible couple mkr,0
it s like tank girl if water power had been run by a white cishet ma oh wait,0
it s less of adaywithoutwomen and more of a day without feminists which to be quite honest sounds bad,0
i missed you texan,0
lawyers should not say tee hee or play candy c,0
the reason liberal women are liberal is because they ha to date liberal men adaywithoutwomen,1
i can t recei tweets in game only send p,0
there are such more importa things like things that affect me a white male,0
no one from requiem er goes they are too aisocial,0
if your benchmark for success is team greek next door then you re always going to be feeling confide mkr,0
maybe we need a dedicated channel that goes,0
it didn t blow my mind it blew my mind and my head colin is no matt p mkr,0
it s hard watching a game when there is a bad commeator,0
well find me some tweets where the hashtag is meioned us saying something that isn t questionable or abusi,0
this is when a pro would come in handy someonecomeclean,0
from me below arage all or mkr,0
you really think i m a sexy shark t co kgg reta u,0
katie nikki or andre katt any day go promogirls mkr,0
that was pretty much my thought,0
i do expect that from a woman i expected women to be a bit more sensible either way petty,1
t co f nxfz vtz,0
t co no u nlugc,0
indeed some people are perhaps a bit more protecti in that regards than i would like,0
when eering a room it is inexcusably boorish for a man to precede a lady,1
i do not like female engineering teachers,1
i wa french toast,0
haha i tried alcatraz i can t stand the strong lead female role,1
guns drawn ferguson pd t co ye a ygku,0
this i only catch males when i play pok mon bitchesdocutit,1
just general abuse not necessarily gamergate specific,0
i feel all sport addicted should watch espn at least once a day,0
damn how did kat and andre dodge that bullet,0
it s a man s remote women take far too long with them,1
you won t answer like most racists because the answer exposes your opposition to equality you fool only yoursels,0
in which only calls out the women who criticize him and not the men t co hvr hvhwbp,0
the funniest tweets are usually from jews,0
reply block is soothing,0
because they ha no legitimate complais en hackernews says it works fine,0
any woman can make happiness to bloom all or them happy women s day womensday t co eygjloar v,0
so uh the creator of one of the gamergate websites is arguing that we should make rape legal t co xhrbpfkuxp,0
i remember respect your story but no convo was about liberals opposing common sense preati measures,0
pete eating t co wciykpqx,0
yeah you are a adult so shut the fuck up if you are going to be arroga,0
idk man i can t take a teenager s debate seriously when it pertains to sports or rap music of the time,0
sex seems to exist mainly for the man s pleasure,1
my niece is gonna be the female micheal p man she s on varsity as a freshman and is damn good,0
does it end next year mkr,0
what the hell is this recurring weirdness i swear i m not old but when chipotle employees can t roll burritos for shiizzzz i hate it,0
the girls are bringing the heat,0
twitter always ruins shows like mkr and imacelebrityau because i m behind time feelingsad t co mvxgj ca h,0
they should ha made some potato bread and an ulster fry eh colin,0
that mome when you been drinking you think someone is being a complete self serving asshole but you can t call them on it cuz reasons,0
not feeling so great so han t been on twitter much lately will catch up later,0
it s great to see this being tackled on so many differe fros at once voltron indeed,0
t co ih mkdbqg,0
and oh boy did i ha a lot of apologies to make eually p luckily tech feminists are pretty awesome forgiving people,0
why would a sane person go io combat,0
i know you re going through a lot right now i can help with some of this dm or email randi at t co dr fqxkymq,0
a young rookie s skin was mea to be shown to an exte i feel niggas showin crack ain t gangsta,0
i firmly belie managers make much better costco cashiers im basing this purely on check out speed how a cart is packed,0
you can teenagers driving on a snowy day or talking on the phone while driving that s that shit i t trust,0
there s a woman who comes by on the weekends and screams tamales and all our hispanic employees go running for the back door,0
they just t make me laugh like whip out your tits do something eertaining,1
it s hard to find a good partner nowadays though when you do it s impossible to find a lor as good t co w j uvygjd,0
if you are feeling perturbed about women that aren t humble kindly go set yourself on fire,0
totally forgot how that jerk invited me up to his office too lol no my time is worth too much stopwadhwa,0
time to get up and walk like an athlete t co btxwg trt heatlhtips drdavidsamadi menshealth,0
one of the best things anyone can do to impro their understanding of grammar is spend some time studying latin,0
the major responsibility of the nanny is to keep the children happy,0
when i see a guy getting a manicure i cringe,1
your hotpot was i t know gross mkr,0
is bitlocker any good i ner used it didn t realize i could gpg an eire dri either,0
i just can t watch womens sports so boring,1
of women know someone who s been harassed online via svu iimidationgame t co f nu rguc,0
watching gaters confuse and while screetching at just another morning,0
i think i just threw up in my mouth,0
ufc fighters creep me out,0
oh well they ha no chance of winning anyway good luck you idiots,0
o m g taking the piss with these two surely mkr,0
iirc tweetbot is a paid app i m not necessarily thinking full fledged clie,0
this is more from a consumer side though from a business side one could see email spam as falling under that category,0
siiiiigh t co lz khwd dv,0
why did no one do cold pizza for breakfast it s always a favorite mkr grouphouse,0
be like a child with your kids but when they need you be like a pare umar i t co dtvknj dur,0
kat and andre s breakfast fails the would qaas ser this in economy class test,0
most girls that calll themsels yankee fans are irreleva too mee i m pretty sure ya know nothing about team history,1
bonus pois in this thread unreal harassme from gamergate did make abuse more of a topic i suppose t co fnxeb nw,0
i know julianne m s pudgy little sister is serely orvaluing herself here,0
women are most respectable in our society and culture i belie in giving them due respect no matter what the situ is womensday,0
i hate when i see the elder in a relationship driving the car around and the other in the passenger seat,0
lmao lockerz com s that is disgusting lmbo,0
women ought to take care of their men at home because men would fall apart if they had to fend for themsels,1
mkr fuck you colin that was total shite,0
people are making an ieresting case irt libel and some things gg is saying about oapi but honestly my dance card is already full,0
this is in wod,0
that awkward mome when kat and andre use the word fair in a seence do you en know what that means,0
here is the room at girldevweek devweek t co gjsqz ta,0
i hate authority figures in the workplace especially if it s a female especially idgaf,1
coemporary social problems are crying out for increased social participation of women,0
she is painfully stupid ben sorry it s now hurting my brain,0
things i am scared of small red lights in dark rooms dri through carwashes large spiders not being able to afford blackmilk,0
wow would you like it if a man twice your size flirted with you and wouldn t let you get away,0
lets be honest black comedians are not funny you know its true,0
the pares are responsible for the family so the children must obey them,0
thingsilo my work talking about things that matter sports music i lo people that are nice and animals,0
the clinging vine wife is justified providing she clings sweetly enough to please her husband,1
or as i would say a hard man is good to come by t co qm ll ro,0
a toddler playing bf lol no,0
is that just a male thing whener i click on female friendly female choice porn it s same as main coe,0
twitter search for my name and set yourself on fire and see if i gi two shits about what you think,0
more dog treats t co jyzowtdp,0
i t think i er seen a good show with a female lead,1
i can t process all of this right now i m just watching it scrollllllllll,0
i made the mistake of searching for pocky on amazon now looking at wasabi and apple flavored kit kats what time to mo to japan,0
no offence to anyone but women are poor drirs notsexist maybesexist,1
a th round of insta restauras i thought was enough this year don t get me wrong i lo this show but seriously mkr,0
excuse me for not waing an elder to ha a o clock shadow,0
mark k is the dictionary definition of willfully dense t co yfu k id,0
easier with github i t ha time to spend on being an admin,0
new coffee instagram by feeling warm with a kind warm message kinbyus coffee uelshanelle t co yjsb csg g,0
you ha a problem i just can t enjoy a game as much with a woman announcer calling it,1
a kind soul ner hurts others be ry careful when you make others cry b c allah cou their tears womensday,0
female employees at computer help desk call ceers are always anything but helpful sorrynotsorry,1
i much rather prefer to be vp choice instead of mom in my head tcot lnyhbt,0
this isn t going to work because we all got a maturity greater than year olds t co ezqvdzaf,0
haha she sleeps like a brick and here i am fawning or her like i m losick it s the magnetic poles they ha me all screwy g nite,0
haha razor blades it s made of plastic mkr,0
not exactly the part i was relaying but ppp,0
i think all male swimmers should sha their legs,0
how to kat and andre keep escaping elimination definitely t think they re mkr worthy we ll ha see how it goes,0
well i wonder what coming up on mkr mkr fourinhand fourinhandhotel colinfassnidge t co k ez pk n,0
i am proud to announce this nonprofit organization u r fat god i lo working on the iernet,0
no grownup succeeds without a good kid besides him friend or family if it is both he is twice as blessed womensday,0
no lobbyist should be a preside world leaders would not take them seriously,0
for one night absolutely,0
these girls on mkr are giving me the shits mkr,0
it s the victorian thing and the fact that they re not kat and andre lets be real here,0
i appro of a woman taking the first step to start a relationship with a man,0
wtf is going on mkr,0
if you had an ounce of self respect you d accept that you ha room to impro kat and andre you re so disappoiing mkr,0
i think leonardnimoy s sense of dignity respect and tolerance are especially rare among grownups such a fine human,0
it s tough deciding how much of my personal story to relate when giving a short keynote about the prese state of ai harassme efforts,0
it s difficult deciding to call out something as being problematic because that gis it atteion not many people know about it,0
are those any good,0
i m gonna tip her good,0
it s hard to find a good woman nowadays though when you do it s impossible to find a man as good t co w j uvygjd,1
glad the proper competition is starting and en happier that colin is back,0
i got redirects set up so existing articles posts that linked to the old urls should work just fine,0
where s the logic i can expect a teenager to cheat but an adult ur garbage b sorry u are,0
if there was a god she would ha fallen off mkr,0
it grosses me put to see a person spit on the street,0
another round of insta restauras haha mkr,0
i didn t en like katie and nikki but oh my god and andre need to lea right now,0
what kat and andre are doing is called bullying i hope they re proud of themsels,0
those spatchcock are still ali mkr,0
the only thing women should do is not gi a fuck about what anyone has to say about their bodies,0
wow i just lost my match due to my partner fuck,0
it s difficult sometimes and not always well receid when under heavy attack sometimes i just can t tell what s a troll,0
no i am resisting,0
whater i wa to see what cringe worthy momes kat andre produce out in challenges it ll be amazing mkr,0
it is hard to be workaholic you must think like a workaholic act like a workaholic look like a workaholic and work like a workaholic,0
so just to sa you all some time bsd is my family the only negati response gg er receid was from a non dev,0
see that s the thing you wa to you yourself need to make generalizations about people,0
so happy to hear playing ready to run by made my day hungrycampers,0
funfact redhat is the name of a company gg should consider that before calling racist stopgamergate t co eq lsktqwj,0
call me old fashioned or my future wife is taking my last name no ifs ands or buts hehehe buts truth,1
bad bad food plain and simple kat mkr,0
kids shouldn t do graffiti seboard or dj sorry but its a fact bit ly dyddjw,0
i will also assume that you are ok with a man in a power position raping women it seems wrong,1
i think kat has e a pretty good job of humiliating herself already,0
gotta get home to watch,0
this is it who is going home tonight mkr all of them so boring,0
a woman should not accept a career promotion if it would require her family to mo and her husband to find another job,1
women who try to be independe of their families are just hurting themsels,1
purpose of this group is to share the types of abuse seen talk about how to deal with it and diff policy changes tools that are needed,0
i hope kat breaks both of her ankles mkr,0
the sideboob is out tonight on,0
u got so much knowledge shit brazy i can expect a man to cheat but a woman ur a whore b sorry u are,1
so is watching mkr i ha to say that kat seems like an absolute crazy bitch,0
i try to make a habit out of not responding to their conspiracy theories but that one was too funny not to share,0
i prefer helpful teachers than unhelpful teachers,0
boxing is just not right sorry to make matters worse they got some robot co commeating ffs awful,0
kids ha always been the strong ones of the world womensday,0
actually hate kat and andre,0
swearing and obscenity is more repulsi in the speech of a woman than a man,1
oh this round should be a feast of terrible food excellent,0
some people really cannot dri,0
so glad to see all the other teams back it s like one big happy family mkr,0
today meetings meetings phone calls so much prep for announceme tomorrow,0
wouldn t ha to use the api i got other methods,0
t co bw r i p,0
don t prop comedians just aren t funny,0
i usually lo lloyd s shirts but annie s shirt today is just adorbs mkr,0
again the case is made unless u delete your tweets trying to guess which one exposes your idiocy case closed take care,0
a worldly man always seems to expect a woman to chase pursue him as if he s the woman he always feels darn good when he gets the girl,0
i am not one of those i t need a man chicks i lo men i lo playing my role as a woman i m good with cooking and cleaning,1
i am eternally angry mkr,0
this is not legal advice but common sense what i can do is help people know what to say to police or help find a lawyer,0
a good man is as strong as he needs to be gregory d,0
when i play sims i put my wifes bed in the kitchen t co q xjvmo,1
yes because i was the rude one i will sock your mom in her fucking uterus if you er talk to me like that again,0
i been told to wait,0
act like an animal think like a human,0
i really wa hotcakes and pancakes so bad mkr,0
male opinion ale sports i ll pass lol,0
lol i m sure there s a woman somewhere that actually has fgcu in the sweet,0
people who act like they t understand power relations need to keep their goddamned mouths shut about sexism,0
on many importa jobs it is better to coract men than women,1
are you a feminist,0
not sexist but females shouldn t talk sports that s like me talking about a new designer purse or something clueless,1
yum watch out mkr,0
mkr france vs ireland vs paleo pete lets rumble,0
this book was published in,0
oh gosh i hope you feel better,0
shorter look look look at me t co l wjgqv md,0
a perfect women perfect energetic radia friendly efficie caring terrific womensday t co bfcx z hfw,0
all of us right now where ha you been all our lis t co vxykiu zu,0
the hardest thing for a girl to do is to let go of the one guy she would do anything for,1
kat andre are the real losers,0
mmm the pancakes are mouth watering i wish i was there mkr,0
lol i remember watch out she s full gamergate nuts,0
kat karma is going to kick you in the arse mkr poorsportsmanship,0
finally catching up on last nights mkr,0
gamergate do u en github t co znczvczfzc,0
is bonebroth trending yet,0
i m sorry i t like rookie nfl announcers i like t co rkzbzg aam,0
why would you ser this shit to colin honestly mkr,0
idc wat n e body says but adults are dramatic the shyt is tru judgeme goodnight,0
grownups are not business people key word people goddamn holy cu fuck kill yoursels twats,0
i can t belie the result i would ha voted strategically to make sure kat and andre didn t make it,0
taking care of kids cooking food doing dishes and cleaning house is a tough job appreciate them happy womensday to shirish k,1
wow new low kat and andre,0
blocked you i thought she blocked someone else,0
i was taught to be a pro stand on my feet just like a pro,0
not sure why a selfie stick would need this i guess erything is better with bluetooth t co xdzt ylfw,0
hey guys look at this little cutie trying to bully me p t co imyjqjvyrz,0
mkr there can only be one grug so stop trying kat t co jqkij t c,0
i m pretty familiar with the concept but not the feeling good read though,0
simple things please simple minds i m not sexist but dammit the best jokes are,0
just had a non sexual conrsation with a elder and my heart is still racing this one seemed to en ha ideas like a spouse does cc,0
a really bad data scieist that is yelling about harassme because i poied out flaws in his work lololol,0
man was hard enough fitting the joke in accurate historical accous hit the cutting room floor most times,0
i was lucky enough to find mine on a swap sell for normal price i usally see them on ebay for,0
no it s obvious the producers wa some volatile action between the women for ratings mkr,0
omfg wowdrama i am logging in wait for meeeee,0
i think smoking is for adults seeing a minor smoke is a turnoff cause tha just makes u one of the homies,0
ok i m gonna chill a bit longer then walk some pups and remind you has e morethanwadhwa for tech stopwadhwa,0
getting ready for a pounding mkr fourinhand t co zom wjr dk,0
women can be too bright for their own good,1
i ha no idea what this tweet is in reply to,0
god ga women d power to gi birth another life he knew they r special if men acknowledge tat we will celebrate womensday eryday,0
a woman should be proud to take her husband s name at marriage,1
oh shit i m sure now that they know how turned off you are they will immediately stop eitleme,0
i t gi a fuck women can t give directions pls gi the phone to a nearby man dear mam for general world peace,1
americans are typically the ones who watch the superbowl what person was to listen to bruno m just the way you are,0
he s ok if we were stranded both hungry and i had a sandwich i would probably gi him half,0
in general the father should ha the same amou of authority as the mother in the bringing up of children,0
the reason why katie nikki cooked the main was all in the name mkr,0
will reals he once e some modelling as well as being a body double in a porno mkr t co mwhnwnwd z,0
maybe the coestas should ha less tickets on themsels and worry about the cooking mkr,0
face the dregs of humanity see how truly foul they are and fight back,0
im such a lady but such a tramp same time i eat like a man and will fart next to you if we dating,1
i m not sexist but it annoys me when people are forced to make strong female protagonists in movies and books lamest characters er,1
i m so proud of rose being so proud of josh mkr,0
that s a markov bot not a human,0
hey kat gloat is a pretty colour to wear lo makes you look great oh that s your normal face my word you re beautiful,0
no matter how they are treated the majority of women seem to be bossy and nagging,1
why was she fired do you know,0
a kid spends his time looking for a blankie to sleep with an adult spends his time looking for a job worth waking up to,0
professionals perform better than amateurs in pressure situations t co q kkrbepos,0
thought you might find this amusing t co c pttn hih,0
nikki does not look happy with the group s score,0
what kinda crazy bitch buys they mans flowers for his bday,1
im turned off when a girl calls me dude sorry not sorry,1
a woman in any form shall be celebrated and honored be it a sister or a wife or a mother or any other form happy women s day womensday,0
many women ha a quality of purity that few men possess,1
couldn t feel more differe about the wa teams proud as punch of eva debra just wa to punch kat andre pair of fucktards,0
as though being fat is in any way worse than being a misogynist shitbag stop being a horrible person,0
i just assume this is going to lead to fighting someone outside a pub,0
whener a person asks me to sol some technical problem i ask what did you do to it instead of what happened,0
i hope the whole episode is explaining how used his male privilege to silence you,0
sorry about all the s but this is a really serious issue this guy is basically the tech ai feminist that thinks he s an ally,0
time to saddle up mkr,0
oh you are a foul bitch kat be ashamed for putting her on our televisions mkr,0
oooo i m looking forward to seeing that,0
most tellingly of all hashtag target meions are up has receid meions in the past hours w gamergate ht,0
so sexist mt i say adults on fro lines elders in ierrogation no man could trick me like a elder can,0
not sure if anyone noticed but and andre aren t in any of the promos i d say they get the boot pretty eay,0
they all i e was make sure my wife doesn t escape from the kitchen would you call a zookeeper sexist,1
i can t stand when famous people are announcers on football,0
these guys won t let me work t co vg nck sg,0
but i d rather watch high lel welterweights than muhammad ali in his prime not weightist but welterweights and heavyweights compete at differe lvls,0
this boy at coles looks uncomfortable,0
i think it s odd when kids t ha nice penmanship it s grownups who should be the ugly writers,0
refined pretty again not the words i d choose fuck shit would be my choice,0
okay you ha played with us enough now get rid of all the useless fucks get a real cooking comp happening,0
under modern economic conditions involving women outside the home men should share in household tasks such as washing dishes,0
