prepro,encoding
mensutra also need to understand it is just a movie hehe,0
i had to left movie before ierval it was craving of cigarette,0
homosexual as i saw in buses and movies clapping and dancing its not for army army represe our coury and i m with general sir,0
who passed this film to release,0
chia wala and rss has give arnab gobar swami to decide u is nationlist and anti national ce ificate no debate on economic jobs any good thing india no bias news channel no godi media,0
arnab please stop crying please gi them appropriate time to speak t take more then debaters i am completely agree with you that such people are demolishing indian history we must expose them,0
bro i didn t watch any part of toy story series yet but i m excited for toy story so should i go for it or not,0
this lady doesn t en know that a term in india lasts for years not years saali america de yaha hero banne ke liye aayi hai that s where the term is for years,0
iam still not watching this movie,0
you did talk too much brother about liberals n you sounded like extremist but i agree about the movie i lod that movie,1
mission mangal is arage you ner feel sort of science in it just sold nationalism see first man or martian,0
this guy is mad ha no basic understanding,1
incredible brother you are right,0
you changed your channel name,0
hit like if you lo ayushmann khurana,0
v r with modiji,0
why would you care to explain,0
bro please do review on joker movie,0
she lo ere di dding,0
www youtube com watch v n zmfqmzos t m s i can t stop laughing,0
she telling to gi the fake information it shows her misguiding the people s,0
she is kung fu kuttiyaa lol,0
superb pratik sir nice for this review,0
freedom doesn t gi right to promote violence which arundhiti trying to do openly,0
i totally agree on all the pois highlighted by u sir but i would like to add a poi according to me the movie exhibits why one shouldn t be like it unils how a person looses erything he los just bcoz of his attitude and rerts only after slight improme in hid attitude,1
but what she is doing invites instigation and her arrest at the earliest,0
godi media shut up,0
time has come for total economic boycott of muslims t buy from them either goods or services there duality of thoughts and actions should not be orlooked anymore,2
who the fuck told that stupid asshole that lgbt is not our culture it was always our culture go read the vedas it didn t come from outside of india it was just banned by a jerk of king in britain in some th ceury and the only thing happened in western culture was that they remod the law and accepted it earlier than us who here are not en ready to talk about the topic they first brought the law and they first remod the law but the people in our coury t en know what s our culture bc mc saale,2
homosexual will not allow in army becoz homosexuality is one of the major coz of sexual diseases,0
thanks my dear friend,0
what they were doing in the beginning of the video is ry natural and cultural this pros how pathetic and uneducated this coury is grow up asswholes or simply ask britishers to come back and educate you stupid snake charmers,1
sir like your reaction and your views,0
it s all ry well about gay rights and gay marriage but where the problem lies is there access to kids is coming closer and that s not right i m not racist against blacks or gays but where i do feel strongly is they should not be left around kids it s just my opinion and i t think i m too far wrong,0
i lo ur reviews but i feel u r biased about its has many things ehich r unacceptable though u han t highlighted it sir,1
bestreviewer www youtube com results search query bestreviewer logical www youtube com results search query logical these feminists and liberals are immature t know why do they go to watch adult movies when they are not matured,1
thanks bro for support,0
kill all those womens who file faje rape and dowry cases,1
hate ads between video,1
you are dumb if you think that nation building is the responsibility of the people of the nation if they are getting influenced by films and doing wrong thing the problem is with them not the movie,0
this is the best thing a man can gi on womens day he should be awarded on the men days,0
you committed crime being born as man,2
i m also a single lesbian,0
disse with decency wrong logic of this lawyer shankar ms,0
yes sahi bola gay in right,0
idoits taare zameen paar these too movie is my favourite,0
so why t you become a direction be the one whom you wa the world to be,0
god bless the husband what is the poi of the courts the law and the police if you are drin to this fuck the a is a for projecting the woman how its gis the woman the legal right to abuse the man fuck such a law hang the law maker to put this a law io the legal system,2
kabir ending was ry powerful really did judged preethi en though she was prege that was true lo really it was kinda emotional scene,0
but can you catch them no if yes fial complian agaist them in court and punish then and put them in jail but you ca this is the fact she is the danderous lady and you are helpless court are reluktu to punish them,0
fuck you my fal and your face fuck youtube girld,2
looks like the libtards only get a hard on from toxic femininity in films where the woman hits men reject mens opinions destroy their relationships whore around drinking smoking getting off on drugs and sleep with multiple partners that s the empowerme that liberals wa,2
fuck off don t u day dare spread homophobia human race is not abt increasing progeny lo n compassion r the essence of humanity if u r iolera towards a section just bcoz of their sexuality then to hell with u,2
omg adv is of mins,0
ranu mondal you are right,0
a medico here hours daily study is must to pass annual exams in mbbs atleast,0
vamshi bommena lol must be wrong choice of girl then,0
bhai i wonder how shameless those people are ery attempt of theirs is failing like uri blockbuster despite they rejected kesari is a hit again going to superhit which they are defaming these librandus are failing miserably thank god bjp came to power nd time,2
that s exactly why i ner watched this movie,0
at best this a shouting match a ry debased debate of the mindless,0
it s good video but not good to murder of female,0
shwetabh ya you can try glass bottles for water abhi i m also using the plastic ones but i m soon going to replace it and m happy thinking about this so thought of suggesting you too,0
you are talking about sucharita,0
please bro speak in english,0
singh i agree with you he los turly so he kissed her infro of family members in her home what is respectable man to lo a women he accepted his ban coz he knew if he will not so the drinking habbit will coinue so it was a cler desion she slapped so right reason lefting her in someone else arms for night pleasure he could not get any information how she is where is she one of the looser act when kabir slapped her she can t talk her family for own marriage again here kabir is moron didn t send their family to cony if his family not agreed with this relationship so they both lea their home got court marriage simple fucking film,0
chandan roy sarfanguri is a great do kokorajhar b,0
so happy to hear this from you,0
stfu and hide in your burkha,1
most faastic review perfect,0
it is permission of conseed sex between two homosexual,0
it ain t wrong i ha a pet dog and he los me and my family better than anyone would,0
salute to this man,0
that s modafuking hago app ad,0
bad message and a bad film,1
make it short yar t need ur discussion and philosophy explained,0
gogoi is there any problem,0
so finally ranga is the real indian and not naushad and abdul kader good to hear that so dear naushad and abdul kaderif if you belie your ancestors could ha chosen pk for you then you are still free to try it to know your worth there and find what india was be loyal to the coury you are living in or mo to the coury you wa to be loyal with,0
super sir you really doing best work for youth thank you so much sir,0
totally agree with you sir,0
eryone arjun reddy or kabir singh partik sir four more shots or kabir singh,0
congratulations drink some soy milk beta male libtard,1
shots ere di wedding etc supports by feminists and liberals but not by you and movies like arjun reddy is supported by u but not by them actually both are wrong those webseries shows sex one night stand masturbation multiple partner as women empowerme which is completely wrong but here in kabir lo is justified thing in movie but slapping a girl being rebel womaniser highly alcoholic and pagalpan is also not good for indian audience to prese because this movie may show only true lo but in real life these lo turns out to be acid attack rape owner killing and suicide in most cases so ideally both type of cinemas are not good to support we are not learning or getting something from these kind of movies webseries,2
so called iellectuals ki mc,2
i lo your t shirt though,0
sardaror sikhs we respect because of their patriotism and protecting coury this is the time to show brary and support caa and to kick the ai national ai caa people nupur great orator and no body can stand before her,0
after this review i realised how big chutiya i was that i kept thinking that this was the one the best lo story bollywood ga us,0
this review is on,0
sucharita tyagi film companion,0
its not petrol its crime patrol,0
she doesn t know what is she saying she is half mad,2
man i wasn t talking about her i just giving you the answer of your theory on charcter study which is poiless,0
hv not watched kabir singh but i watched arjun reddy i liked it,0
yes bro you ar right,0
www youtube com watch v n zmfqmzos t m s savage lel,0
who cares what feminists says,0
i just lo how two women shout or each other about another women,0
watch shahid replying to a typical feminazi while movie promotion youtu be motbydqmr a if i start justifying character i ca be an actor i ha to play characters for their good and bad i ha to represe them honestly thats what acting is about otherwise im just waing people to like me thats what stardom is about acting is about being honest letting people hate you sometimes and its ok its importa,0
watched it what a brillia romaic movie after a long time ery actor has e justice to the character songs are soul of the movie,0
nrc at prese only applies to assam npr not stared or not completed,0
very ry ry ry good,0
i literally cannot imagine a scenario where i d be watching coe from this channel lea alone penning down a comme i personally abhor this propaganda infused right wing program and ha reported it multiple times it s in the best ierest of the nation if it ceases to exist from the digital platforms and is confined to television only nertheless needed to get certain thoughts off of my chest so here goes stop broadcasting these staged debates that resemble poorly produced b grade flicks at best the background score during the iro the participas who are more like the bickering neighborhood auies than dignified panelists etc stink of sub standard nonsense stop fooling the public instead of all this nonsense why the hell can t you show how the pm and home minister ha successfully confused the nation and are literally behaving like clueless self coradicting juniles with a few days left for our nation is yet to orcome the confines of religion i had high hopes for my coury and had started believing that we would achie great heights in the field of science and technology that would put us in the big leagues but no we are all weighed down by this archaic concept read religion and ha ensured that progress is a goal that is quite far from our reaches a note to republic tv instead of showing all this nonsense about ai nationals lutyens and what not please focus on key items that are deterring our nation unemployme poor economy etc the mass does not care about the sub standard reporting you do on these ridiculous theories they wa some concrete information that the news channels alone can provide,0
meena bible is the only word of god in this world that changes lis bible has built the most deloped couries of the west and has coributed to the progress in science and technology without bible there would be no scieific delopme and progress geeta has coributed to the misery and hopelessness that india shoes following geeta india has become a poor and non producti society if india accepts the true god yahweh jesus of the bible india will be deloped and prosperous i mean all of them not only few rich people but whole society will change because only jesus is the way to god the father and he is way to hean and only jesus gi salvation and eternal life,0
i m agree with you bro,0
committed suicide in comparison to married women whereas the same figures for the years and are and and for are and while there has been a lot of hue and cry for domestic violence against women with various studies being sponsored for studying the,0
www youtube com watch v n zmfqmzos t m s we people take it as romance,0
when she arundhati say these absurdly to name your self as kung fu kutta the shameless du studes are clapping and cheering,0
gr job it is the best way he could ha replied to his inlaws and pathetic law makers,1
please your mobile number sand me now,0
she is christan by religion n she do like if hindu unite in india,0
but bad massage are giving to socity by playing there characters ry well but on meaningless coes either they choose to do these characters they can choose other coes like article masan there are many youngers issue irrespecti of all these bullshit,0
exactly that was x better than shitty,0
don t use abusi language,0
why rajdeep can t criticism in arundhuti roy media ka dogalpan paid media,2
what a shame stop putting us in the wrong light we will never a kill a woman for loving a man bastards,1
army is only for real men and women i t understand why supreme court legalised it,0
khandayatray lol you are one of those people who are fed up with success of narendra modi despite your discomfort whole population of your kind is so ignora and hypocritical you can ha satisfaction that your comme got few likes nothing more than that nothing going to change you can cry shout yell but deep down inside you know that you are biggest loser,2
nothing is true about your stateme all the thing you ha said about feminism is not real those are called fake feminism first understand the difference between them this film promotes drug smoking and alcohol how can it be a good movie,2
trailer hi jhand tha bollywood is garbage except movies,1
thakur actually pratik is one of the few critics whom we can trust and he is leading the bollywood industry and audience in a good direction,0
like for kabir singh comme for ere di wedding,0
dodiya it s not about seeing from someone else s perspecti it s about understanding other s perspecti read this twice and think carefully,1
i wa to be a transwoman for my lo,0
kutte ki tarah pyar lol bc satya vachan although i will agree with that poi of putting item song in nationalism films also like seriously bc out of any other genre why item songs,0
i m not a liberal or a feminist i do none of the things meioned by the chap in the video but sorry to say kabir singh is an absolute bore really not sure what traditions kabir singh is promoting i t know what this chap is going on about,0
that is so so so true sir,0
viswambharan ieional meaning of this comme was is a surgeon doctor and he does strange things,0
nice msg in end awesome video,0
why does all arnab goswami shows transform io a shouting match,0
looks like ms kasturi has no idea on the law freedom of speech is differe than sedition defamation,0
my favorite video yrr,0
mujhe aaj pata chala itni faltugiri karte hai liberals feminists and ye more shots itni bakwas hai like seriously as a girl kitna bura laga mujhe ye sunke how the can show such things like all protagonists are girls but this is not at all what we will like if happens it s so cringy it s simply so wrong how can they take such things so casually i wonder who watches that,1
and yes movies do affect human behaviour especially if that human is an indian long back there was a case in australia where a man of indian desce was charged for stalking and harassing a woman he told the court that he lear all that from bollywood movies and the court on finding that bollywood does portray men and women in such a toxic manner buried him yes movies do affect our behaviour,1
iam from odisha state bhubaneswar iam specialist body massagboy msg me on whatsapp and call me now for,0
great work hatss of to u sir big fan of yours,0
in a min length program arnab consumed mins including ierruptions starting poi and short briefing on the matter he invited guest so the rest didn t got en min to speak he invited them to listen him,0
i t understand one thing the hypocrisy is so visible and yet how come so many iellectuals are acting like idots to defend all these created confusions and lies look at this panel too that chethan has absolutely no poi and yet comes here and keeps shouting erything other than a logic to support the kunfu kutha,0
actually sir you are eye opener for our society,0
i m a south indian i felt arjun reddy was a biggest crap movie i still wonder how that shit got remade io bollywood and en the original and remake rsions got critical acclaim like something is seriously wrong with this society and they are calling this garbage a cult classic,1
you should review joker,0
i m from pakistan koi pakistan se girl ho to wo mujhse coect kry but i m not lesbo bs bht sari dosti or thora thora pyar ho koi ho to ajao plzzz my dear friend,0
stupid ranu mandol i wish she go back to how she was u poor lady not kind,2
right brother i am bangladesh,0
i just hate this movie though i ha no hatred or doubt about shahid acting he really nailed his role but this kind of movie is not made for india bollywood is producing nothing just crap movies with a small pinch of lo they need to grow up en indians need to grow up too,1
pratik ya l wa to ask you something,0
she is joker ranu mandal,2
nupur plz come on yaar,0
sahu india is a failed state and so do nsa you ca scare us with your nazi gestapo crap,0
savage bro bt nowadays public getting proper knowledge they know wht do feminist and liberals,0
homosexuality is against nature thats all,2
i personally belie movies are mea for eertainme only so t take it too seriously,0
you talk like a child,0
i lo you to,0
shwetabh can you make a review on chhichhore it was a good movie but it will be great to see your take on it,0
this film about gay people is rubbish how could you come up with a horrific video like this shame on you,1
yes bollywood is waste i agree,0
thank god we are muslims otherswise we ha to face such a irritating law proud pakistani,1
this is irresponsible flawed filmmaking like raju hirani does ending is cherrypicked,0
dangal is the only movie which gis us a message that commitme and hardwork will bring us glory very inspirational movie,0
amina levy khan so is prests raping children,2
is the section number section in indian law which punish homosexuality,0
this lady is a bloody anti national throw het in bay f bengal with another s anti national mamta send kejriwal also as bonus,2
he knows that s why he is making this video and you are watching it and off course ery boy will like his girls like you always dislike this it is your feminism,2
rsd top journalist hats off,0
ery pla tree animal en bricks ha an ideification where did it come from how did it get here what s it s name they ha all been embraced ha coributed to the advanceme of the coury we human beings cannot walk around like a lafanga no name origin etc the world is moving fast if india is not ready to be part of the earth chaos will ensue the govt is doing what they were elected to do make every resident revelant how can they do this if they dont know who the f you are dont make the future generations null void,0
she should be in jail,0
what nonsense the illiterate people ha ethics the ones who are brainwashed with all the shit going arround in the world might be the ones who are physopaths but none with some sense like violence agains any kind so stop assuming bulshit,1
this girl should be raped,2
name will be kasturi shankar and they call jesus christ thats how wolfs cored with goat face,0
she is telling kutta n billa for the people who are ai caa ai ncr n ai npr,0
feminism should conrt to islam,2
i m following you from past years,0
arnab where ha u kept your spine dear is it in pm s office do some journalism man get well soon,0
worst was that despite knowing his drug drinking and anger problems his friend offers his sister for marriage lol apparely friends are more importa than blood relations that too for friend who anyway treats him like shit any dece brother wouldn t wa his sister to marry such a guy,1
are fucker holly ar fresh ki same,0
this video is made for people like you only,0
i m a liberal and i t do that i m tolera towards eryone that s all,0
feminism and rd wa feminism are two completely differe things rd wa feminism is all about attacking men and misandry and of course toxic masculinity exists no one can deny that rd wa feminism is basically toxic feminism they re the two sides of one coin,0
so much lo from nepal bro,0
please share the number,0
you are absolutely right brother i am agree with you we all support you,0
this video is for sucharita tyagi from film companion,0
hello partik just watched spider man far away from home i really didn t enjoyed it s not up to that mark it s released in new york city so just feel like to gi you review rest eryone has der own taste i didn t like it waste of time,0
this is the limit man how can someone openly say to gi wrong information to gornme and moreor some people are defending her on national television,0
i always follow this man s review,0
this guy doesn t en know meaning of liberal and fiminism,1
lel of observation and criticism,0
you are great sir when a i saw a movie first of all i saw your review then iwatch the movie,0
do not fall dark light on gays,0
haha what a joke u should not speak dude,0
brother poi is totally good,0
please call me i m waiting okay,0
peaks of hypocrisy but why,0
thanks bro for the video i really lo it,0
my friend had suggested me to watch arjun reddy the telugu rsion and after watching that i was really dissappoined with him for his selection as he said indians are chutiyas they take movies really serious,0
true review about film and fake librals too prateek sir keep it up the same honesty,0
fuckboy isn t good but a bully isn t either skewed feminism is dangerous and so is toxic masculinity i totally understand that you ha a lot of hatred for liberals n feminists which is justified coz of what a lot of them ha been propogating but not ery idea of feminism is wrong pratik bollywood has a history of showing these things cool that is my only problem with these characters i am all game for negati characters but i t like them being glorified making them look cool i won t en start with shots i didn t en like alia s aggresion in gully boy so it s not one sided as much as i enjoy your views on nationalism our history i didn t feel comfortable watching this,1
why is my commes censored this is how the divide begins,0
true bhaya true just subscribed baah i lod this video,0
this review is shit,1
to be honest your thinking is your own opinion it does not mean it is fact reality though i respect your opinion i think u shuld also learn to respect other opinions as well,1
this poor guy facing prison for someone creaction women should be rape burn and kill before the law take its cource once in the hands of law your to year fix for law tourcher on your famely,0
you r the best in the world,0
l like it ba ba ranu bi,0
due to this video i become ur fan bro i m subscribing ur channel,0
nice review brother lo you,0
ranu is ry bad,0
peoples now think i am good god mom my teacher swetabh gangwar,0
vedio starts at www youtube com watch v n zmfqmzos t m s,0
arnab its good to expose the pseudos hower nrc will be a big flop show as the bureaucracy is corrupt and they ll goof up the whole exercise i hower support caa as the people who took shelter in india due to religious persecution cannot go back especially hindus,0
we are proud of sohum shah to make such good choices and that actor reminds me of you,0
i still cannot belie and understand that who has made her a celebrity author and writer kind of language she is using against elected indian gornme under the guise of freedom of speech is a matter of great concern and shame to all of us,0
s this is what happen if a is not corolled man this nation is going in path of falling in pit of shit the young man lifes are in risk because of a beware before getting married marry good women not devil because devil will able to change face anything anywhere,1
i completely agree with u,0
problem is not the problem problem is your attitude about the problem jack sparrow,0
i t know such a boring movie left the theater after min,0
these people who talk about nrc are totally ignora please read and understand do you wa to li in a coury where there is no register of citizens assume if there is a benifit of a kind being distributed by the gornme to the citizens of india now where is the stand of billa ranga and kung fu kutta they get zilch you idiots think god has gin you the brains do listen to this arundhati kunf gu bitch,0
pori moni is best,0
very well said dude totally agree,0
fuck you pratik on your face,2
first time i lo ur video nd thought well said,0
madam the sick meality always sees negati in ery coe just like you we ca stop people thinking wrong in a positi movie its all about our decision and this is just a movie it ca be real eryone knows it except some like you,2
u re great sir today i ha watched kabir singh i agree with you being a woman,0
