prepro,encoding
people like arundhuti roy should be deported to pacific ocean,1
if man thinks without any involme of sex the world would be differe,1
hehehe ur way of talking in nice u r true abt bollywood,0
finally a valid review,0
these stupid indian faminists watch stupid american faminists on youtube and try to imitate them,2
and i was about to watch it tonight,0
that moron who said bevkoof hai jo support kartay hai screw you,0
dada ranu mondol maap er bairer mal oke niye alochona kora tai bekar time nosto kora chara r ki u noy,1
now please make a spoof on adultery act,0
kill them almighty push,0
i we to watch the punjabi movie shadaa translation unmarried at the time this movie released you released you can sense the enlightenme my mind has achied,0
totally agreed i felt the same during the movie mission mangal like why the hell was there any need to put such characters,0
and what about random senior coming to class and changing seating were in reality u need special supreme court order then only studes will b like ok i will sit there,0
iam single iam from odisha state bhubaneswar i lo hot and sexy movies and enjoy full night if you are ierested msg me on whatsapp,0
i keep stay away from such movies www youtube com watch v n zmfqmzos t m s best,1
be happy and healthy,0
finally about fucking time,0
arundhuti roy s gesturing is of a prostitute which it means she is really a prostitute does the face of her not look like that of a prostitute warming bed with so many new for being sexually molested most frequely of her own choice others also are of the same habits with other male couer parts,2
osm dio keep it up make more dios like this,0
she should be immediately shott deadd,2
she should be jailed immediately,0
i am waiting for the review,0
please make a complete raw analysis on the movie joker,0
true one of the best,0
ye buddi kunhei yar arundathi billy ya kungfu kutta i can t understand yar,0
brother please watch mission mangal it is gem of a movie,0
better not to watch only,0
review on feminism dude you ha some serious issues regarding feminism your reward commes full of misogynist thoughts,2
www youtube com watch v n zmfqmzos t m s can t stop laughing,0
i lo you girls awesome video i am girl,0
i also think that character of prateek singh was deeply flawed,0
arundhati roy the commie naxal favourite of pakistani tv channels can say ranga billa as she is free to express her opinion in our bharat but the address rajdeep conniely ignored it why behn lagte hai kya bloody urban naxal,2
what the fck his lol stupid i think its her,1
some guys just get damn ideological in some films like they are gonna add in secondary education,1
you should add subtitles,0
how our govt going to stop this arundhathi roy like people we wa peace and delopme of our nation en opposition parties not doing any favour to support our nation but they are bothered about their own position as prese mody govt working to clearing all pending issues of our nation and putting our nation io fast delopme,0
very well dissected video,0
we can t allow to pollute our brary environme of army to conrt io a environme of coward and insane who can t face all that we face they are not more like boys en not eirely girls and they can t use their own power at right time to couer with difficulty,0
arundhti roy is gone his pakistan no li in india,0
nupur sharma ruined the debate why isn t arnab reducing her volume like he did for the congress guy rather at www youtube com watch v n d ilngama t m s arnab says nupur please common yaar,0
i knew it was coming lol,0
good review brother you ha understood and analyzed the emotions correctly dumb people need some brain and heart to understand this movie good wishes and huge respect from telangana,2
kabir singh uncensored full review,0
please deport her to pakistan or afghanistan to satisfy her pseudo iellectuality she needs issues as oxygen for her survival as far as i am concerned she is a wretched lady in her late stages of life,1
k feminist disliked the video,0
beggars are now erywhere hit like if you are agree,0
hey shwetabh which is your favorite bollywood movie of all time and why pl reply,0
pratik i read the review of hindustan times and en i cud feel the happiness inside me feeling the how horrified ultre feminist reviewer was god they deser more such slaps,2
bullshit adrtiseme of tinder on filter copy and patakha and making me insecure all the time to ha a date with someone which i t get,0
i m a ny based indian filmmaker and i found this review so immature so with due respect pls go and study what film and filmmaking is it s not easy to be a critics so plsss,0
back to railway station,1
take notes from fight club tyler durden is the badass and coolest character er but the writer only says he is the negati character and not a character to take inspiration from but in kabir singh things end up in favour of him telling be like kabir singh it s nothing wrong,1
the real sh t,0
paul it is reality in india indian women marry for prestige while indian men marry for money dowry and connience it s usually ner for lo indian men kill their wis for burning the dinner not paying their full dowry or any list of reasons ery year if you knew about indian society this film would not shock you at all,1
maity nice sister you are right,0
agree with you sir icc match india win but afghanistan play awesome today maza aa geya good,0
i m so glad i watched this video erything i thought about the movie matched with his review lod the review ery bit of it was on poi,0
first stop aborting and killing daughters before birth and stop throughing them in dustbins then you will ha many people for trying,1
wter modern feminism is dog shit,0
nishakeyaghosh www youtube com results search query nishakeyaghosh awesome,0
liberals dude u embarrassed yourself in this video i han t seen the movie so idk if this movie good but u ha embarrassed yourself seriously so do talk about the topics you do know anything about i am not feminist,1
how arundhati is in india who se her here she will not come of her own means some leftist funded her and she landed here to creat nuesence in india why she is openly moving to misguide the people of india,0
i lov ur video dada,0
n k choudhary you are communist no doubt increased number of communists like you ha taken india to a barbaric lel it is almost behaving like a terrorist china or nk,0
you said exactly what i waed to say in fact usually i t watch lo stories but i came across a review by a feminazi who bashed the movie i immediately decided ab toh zaroor dekhunga,0
coz it has the worst story er,0
of course she is afraid of showing documes that people will know that she is suzanne and not arundhati it s like story of cat who lost its tail and preaching other cats to cut their tails people who bark that she is not suzanne ask her to show her documes,0
haha how could u sir ladke hain gussa ajata hain rape bhi ho jata hain haat uth jata hain u can not justify one wrong thing with comparing other wrong thing,2
if you add the flaws in the movies regarding his medical education this movie will be absolute tatti for all,0
damn dadda you really know how to do a surgical strike,0
www youtube com watch v n zmfqmzos t m s the perfect lines for us youth,0
good i like your review you review you are braad mindend,0
your videos are blessings,0
shoot this randi kutti lankesh needs company on hell,0
this many is really funny and most serious joker on tv,0
i was cried at the end of the movie weeped like a child,0
all of them are available for free on youtube and it is a shame that indians are uploading it on youtube rather than asking eryone to watch tumbbad on amazon prime,0
more subscriber does not mean big brain,1
kabir singh is a movie about a self destructi man who also needs therapy and anger manageme classes my classes my cousin forced me to watch it i was dying inside watching this shitty movie,0
finally some one understood what director wa to say in kabir singh and what our filthy feminists liberals are demeaning india men,2
i am a gay and i t care that public and sosity what think about me i ha not any friends because i am gay kya koi mujhse friendship karegaa my no is please reply soon after read my message,0
very good bro excelle i like it,0
take legal action against arundhati it s like asking people to mislead by giving false information for legal records it s a crime arrest her,0
lesbian and gay just fuck world india go or smart fuck india copy usa and main devil usa fuck world,2
bhai next to part video,0
his films are mea for family audiences he doesn t do any vulgarity or adult coe films,0
if she was a beggar how can she know english and her attitude o my god its too much,0
the so called feminists try to be superior they are afraid of equality please bring equality that s importa and beneficial for society,1
sorry bhai but i ner share your videos because the knowledge u gi is precious,0
sooooo you are not a lesbian right,0
nice to next culture,0
arnab is exposing these fools like onions,0
nice shirt pratik bhai,0
bollywood also made great movies like super chhichhore war better try to watch good movies instead of shitty housefull,1
only single sensible person in india about bollywood respect from pakistan,0
copy and pest that is wat bollywood can do we hate hindi chindi movies,2
you deser million subscribers,0
nice video form jalpaiguri,0
wow india is progressing day by day now another responsibility for the indian pares to look husband for their sons and wife for their girls then gay couple will gi birth children by surrogacy what will happen with the children who won t know who are their mother guys please tell honestly the children who see their father and mother in a complicated relation how they fell now how the children will fell when they will know the truth about their birth they won t get their mother s lo why they would be deprid from the right to get lo from their mother their half of the relation will be cut down which are from their father s or mother s you are supporting this heinous act please think deeply,0
she is funded by foreign agencies incl china and pak don t belie a word she says she is foreign citizen,0
god please gi him past life,0
i mostly ner watch whole video on youtube but your video i ner escape en i wa but i can t,0
indian consititution say lea criminal but do arrest innoce,0
when i see notification of this video i was like aha here we go,0
lal good morning ji,0
yes sakar all is man vogoban,0
true bro watched last moh this is the pdf of the book it is based on slobodni unirzitet srbije org files robe kanigel ramanujan pdf the book is en better,0
do u know the details of the case isthe man in prison,0
show her article on afzal guru hanging,0
begger arundhathi shame on,0
why the govt is allowing her to spread hatred against india,0
bc chutiye h liberals pesudo feminisits,2
when a rape scene is shown in the film feminist and liberals may be sleeping very strange so called item songs with cheap words t come to their notice,1
lo is lo i respect and support lgbt community at least its a bonding and commitme of two los no force no rape,0
come on republic your all debate is good but t bring that shouting lady io the dabate for god shake she always spoils it,0
your commes eigjakli rait,0
www youtube com watch v hl bnpznrqi feature share www youtube com watch v hl bnpznrqi feature share azad vai,0
you are away from reality and ha ry less knowledge you only focuses on surface ry unfortunate,1
plz bro do blame bollywood for it the main culprit is that director sandeep vanga who also made arjun reddy and remade it in hindi he totally destroyed the lis of youth,0
u r correct thanks for spreading the truth,0
before watching this video i thaught i am the only one thinking this way now i understand that if u are the only one with differe thaughts in the room that does make u wrong i feel so good,0
left my pares relatis all still i m afraid please sa me she slaps me abuse me so shameful,0
that s what u can expect from a most realistic person nailed it,0
sb pagal sexual tharki log hain gay lesbians dats pure lust not lo i wonder if mother nd father needs any law to show their lo my brother my father los me widout any law imposed by sme gay cji deepak mishra u do need to be gay or lesbian to lo sme u only trying to satisfy ur fuckin sexual realtion by hiding behind sme lgbt laws,1
it seems like these people wa to be famous nothing more they t care if people die by their hateful talks,0
he is talking about which movie,0
i thought that lgbt are minority so it shouldn t effect much right,0
the best review about kabir,0
horrific message and worst portrayal of gay people nobody has the right to take other person s life whether gay or straight maybe it s cuz the people behind it wa to create a negati propaganda around lgbtq community totally disappoied,1
i think bollywood people feel threatened by the south indian film makers that s why they comme nonsensical stuff,1
nobody ga a shit about alia s viole behavior in gully boy but here s behavior marked him as possessi feminist www youtube com results search query feminist didis and yas tb kaha the,2
salute to you sir great thinking,0
recely i watched dear zindigi and i think that was damm awesome and i bet uh can t en poi out single mistake in story,0
kapoor what s your instagram,0
kabir singh is india s reply to doctor strange,0
kumar and preeti had none of that she just had some stockholm syndrome,0
kabir singh was a well made movie in terms of all crafts principles and art shouldn t be seen together dumbos,1
people are buying bullets,0
all right dada you,0
krahi yes bro same feeling,0
i feel you bro,0
if kabir singh had e all those things to your own sister would you like it encourage it applaud it,2
truthdemon no i t know him personally it s a relation by pain and relation of same pain is bigger n better than blood relationship,0
get lost arnab your debates are like this go and learn journalism first,0
please do a fan meetup we wa to meet you in person there are many community ceres in and near saket that you can book for same,0
k dislikes by librandu dogs sukooooon,1
what a hate fest one find s on republic world all hail modi the new indian caesar be careful devotees of caesar caesar s are always corrupt megalomaniacs who t gi a damn about their devotees sacrifice them at their whim,1
kabir iron man tune mix youtu be rdullff za,0
feminists talk about rights all the time it would be awesome feminists as well as non feminist also talk about responsibilities,1
i like your videos sir bhot hard bhut hard,0
wow what a topic hit like for this,0
she has lied before she is lying now and she will be lying before all for dollars a sex worker is better than this female atleast she doesn t disguise and camouflage shame on this scum bag,2
what a lousy moderator arnab is falthu show,0
likes for you boss,0
why not arrest them i know that census was e incorrectly during upa that is why they are in so panicked now,0
mr kabir fan stop glorifying and confusing anger and physical agression as lo a movie showing of repeance and of aggression directly instigates negati behaviour you will get your answer by viewing the audience of the film it s not feminism but humanism this is clear chauvinism,2
the director is homophobe wrost movie er,1
any bastards can enumerate themselves as arundhati roy s husband,2
what do you mean of freedom destroy the coury thats what mean freedom of speech,0
reading the subject i just came here to like the video,0
nice acting special check shirt guy who we to collect the information and while hugging after bathroom story lol,0
eryone know who is ranga billa in curre situation,0
not funny at all bro you should stop uploading videos i hate your fooking face dicck face,2
bravo india needs more sons like this great job,0
how can someone make this stuff assholes,1
i hate people who abuse lgbt,1
www youtube com watch v j j sssp yq t m s same herw,0
u deser more subscribers sir,0
i will say my name is arundati roy lol,0
best line nationalism mein bhi cash cow,0
and what about the girl s life he left her but he s man his body doesn t get affect after sex after en leaving her belod one he still we to various girls but what about her she was giving birth to a baby nurturing it all alone and then still the film protraits that the girl destroyed his life and he looses erything,1
nice t shirt man,0
thank you bro i was thinking to see he movie initially but now i think u ha sad some of my time,0
now remember these english speaking monarchy minded congress and hippocrate communist ha to polish shoes of common people and they will get room below shoe to take rest,1
www youtube com watch v n zmfqmzos t m s real story bollywood logics,0
eryday who the hell are you it,2
what a cunning and in actual a idiot women who thinks she is iellectual idiot are people clapping at her idiot propaganda,0
very ry ry bad,1
he los turly so he kissed her infro of family members in her home what a respectable man to lo a women he accepted his ban coz he knew if he will not so the drinking habbit will coinue so it was a cler desion in end she slapped so right reason lefting her in someone else arms for night pleasure he could not get any information how she is where is she one of the looser act it was she can t talk her family for own marriage again here kabir is moron didn t send their family to cony if his family not agreed with this relationship so they both lea their home got court marriage simple pethetic shit film,2
neha gupta worried that her bmw emi s may be affected if she can t make up bullshit cases,1
do you know pratik sir movie was awassom but somewhere it has become bluckbuster just becouse librels protest and negati review,0
first rajdeep tried to defend her but he failed to do so,0
omg what a retard,2
sahi kaha logic lel bollywood,0
gornme should immediately put ar behind bars for giving such illegal suggestions kasturi shankar seems to be an actor without brains plz do not call her again ry stupid commes from her,0
fucking left liberals and feminists,2
i was waiting for it very honest opinion,0
ry ry ry nice,0
i was waiting for this video from a long time,0
i know shwetabh is not going to read these commes but i just wa to share my view,0
dislikes are coming dislikes are coming i m enjoying this hate towards this film that hate is what keeps us driving on to make more such videos and enjoy on these femnists and libatrds anger and irritation,1
this time i agree with you prateek,0
she should be arrested immediately payal rohtagi was arrested when she was just stating facts and she arundhati bitch a big chinaal is provoking people and abusing our leader she is challenging to us and what we are doing,2
sir please review iru mugan,0
if arundhati roy is living in usa then she should say the similar things about the actions taken by preside trump or there and see the reactions in the usa media about it rather than speaking such kind of foul words about the actions taken by the modi gornme in india,0
too good video best of luck,0
best guy u are bro,0
shrivastav true but film companion has more subscribers more audience if they put up such negati views on society it s better to oppose them,1
govt should deport her to some peace loving islamic state,0
good one pratik most critics really know how to ruin movies which we enjoyed so much,1
when are you going to expose modi and amit shah s lies arnab,0
more of these kind of program needed,0
what is i m from pak idk plzz explain,0
most bullshit channel i ha er seen,0
gohel akshay is in india only for managing his business the mome his acting carreer flops he ll take all his money to canada and wo return back unless to attend es and will send his kids to earn in india too and then return back to canada with money he has earned here,0
tv news channels now a days are just mea for eertainme news channels should be independe and ha no influence of anyone to function properly i ha already boycotted news channels from last years and know many people ha e so unless people who like to hear useless or masala made news it would be really nice if mr arnab would use his tale to highlight and expose the real hidden issues of our coury lost complete faith in media except few youtubers who still does their job with honesty bringing out truth in public what ms roy has said all started judging her but what our honorable prime minister said no media would ha er bothered to debate on that matter hope all remembers urban naxal etc,0
good u r showing the real world exposing the feminists and liberals,2
k concerate on basic issues like jobs medical facilities education gdp not on religious discrimination,1
movie only means its virtual,0
till now i was appreciating this movie but now after watching this video i think that the movie was shit it was a fucking bad storyline thanx shwetabh for this video also tou are right that new actors like ayushmaan khurana are much better than these fucking bad ones,0
wow finally a sane voice amongst the dimwitted imbeciles in the comme section bravo,0
come on man get your basics right,0
scott adler his wife put false case on him because of which he spe mohs in jail after being released from prison he immediately reached his in laws house and stabbed his mother inlaw father in law brother in law sister in law and finally injured his wife critically i belie you got the message,0
jhand movie is the perfect word,2
ranu u r randy,2
are these guys indians or isi sponsored ai indians i feel sorry i was born in india which has deadlier enemies within the coury than it has outside of it,0
man and we ha movies like palm d or winner the lost weekend which has showed only the si gle side of alcholism and the master which has only singular themes of destruction both movies are made by world greatest director billy wilder and paul thomas anderson,0
true feminist is cancer,2
i and my wife abroad and laws here are ry equal my wife ga me dhamki that she will file a case against me in india under a she did that as well and my pares were harrased,0
you are right sir,0
i think you are ry depressed you t understand conse,1
sera nothing to say really it s a mind blowing video,0
arundhati roy has a sick mind its not about ai bjp or ai congress she is ai india and she has been so for a ry long time now i t exactly remember the year but i clearly remember her sharing stage with kashmiri separatists and giving statemes like kashmir doesn t belong to india and the separatists were applauding her she is a person who has absolutely no affiliation with india she is a scum and desers a bullet in her head,2
i also watch thousands of worldwide movies korean japanese hollywood taiwan seriously after a decade i will tell you that arjun reddy is a cult classic movie in india it s not a simple lo story bro you are awesome you are telling the real truth,0
i wonder what feminists ha said after watching fifty shades trilogy,1
good job nupur in exposing these fringe elemes and political pollution,0
liberal has rights others ha wrong,1
luck well i am from haryana a small city called hisar you can gi me your number if u wa but frankly i will not gi you mine i would like you as a friend if you would like we can chat on facebook though,0
it might not be cool in some situations but it is cool and has a greater impact when it is used within a closely knit community of real men of titans,0
a ry beautiful step to corol our coury population ery one has right to choose,0
i lo you dada,0
arundathi roy has no right to li in india if she instigates violence through through spreading her dangerous ideology we indians should not fall for these kind of traitors please beware of these kind of people spread awareness we need to stop these non sense,0
sucharita from film companion,0
arjun reddy is king,0
www youtube com watch v n zmfqmzos t m s one of the best pois in this video,0
actually she was a prostitute before being a singer,2
that s why the movie a man who knew infinity not released in india one of the great movie of ramanujan,0
that s not our problems,0
nation does u people get out from india,0
simple genuine explanation as it should be taken by eryone male or female my question here is people in real life also do that sort of escapism when responsibility or stress is oo them like men do ordrinking drugs or kind of abuse you were telling about women run away with their choice cut their in so are these not the signs to say enough about the person and what should we do for them if we can t lea that relationship like he she be my sibling with such behaviour,0
arundhati roy herself is kung fu kutta a dog,2
bro review lal kaptaan btw ry eye opening review,0
ranu mondol i hat you,0
bitches spoil a men life,2
crash lul toilet ek prem gatha that movie was great msg for peoples and he has citizenship of canada but still living here in india and yeah that movie toilet ek prem gatha was offered to few actors before him but they rejected the film because of story,0
hahahahhaha arnab goswanmi and debate hohoho what a joke,0
isiliye to real life ko movie se compare nahi kr skte,0
bro you need to see some valuable coe like tamasha rockstar rockon nd many more,0
indian people easily adapt what is shown in bollywoood or any other movies they start doing that type of things that is shown in the movies its just a movie i mean what s wrong with these people its ridiculous,2
one of the best video of your channel,0
i agree but movie affect indian then t watch movie it s simple,0
take steps corruption free govt of india,0
here the best part came,0
kabir singh is a useless movie,0
hi i lo you,0
spoiler alert spoiler alert,0
do you know what feminism really is i think you are only aware about the pseudo feminism and you think that feminists are doing bad for society really,1
she should be booked immediately under law action to be taken immediately to put her in jail,0
