prepro,encoding
i didn t watch that kabir singh movie but i watched telugu rsion arjun ready reluctaly i agree with shwetabh but in arjun ready hero will mo on gi up his bad habits after his grandmother s death and not for that girl though he has bad habits i felt his character was genuine he didn t not wa to escape from punishme or karma for his deeds he agrees his crime in the court he didn t not wa to escape like a coward and lastly he knew that he is wrong he knew that this is a phase in his life he knew he is going to be changed and wa to change but can t because he is addicted sincerely i didn t like shwetabh s poi of view for the first time may they changed story line because of bollywood s pressure,0
the undercor rock stars excelle work,0
only here to dislike this randi,2
i like your spitch,0
see the rotten face arundhati roy with stinking ideas spreading odour all around en pig look beautiful than this aged sow,0
ar is not a patriot,0
is to good bro,0
kabir singh vs halfgirlfrnd vs shaadi me jaurur aana,0
brother you talk to you right,0
really now a days ayushmaan khurana one of the best realistic hero thank you for meion this,0
right you are right absolutely a huge respect,0
borade just saw mins of the video you recommend and seems like you write your own dictionary sorry but i would be following other dictionaries like cambridge and merriam webster,1
who is watching this after india beat afganistan in world cup,0
feminism means equality not discrimination first you should learn about this go and study about feminism,2
star there are some unwaed guests in your house only you n your wife are earning working hard to impro economic conditions of your family how long will you keep these guests who came uninformed using your and your children s resources and coributing nothing to your family further these issues are long kept unresold inspite of supreme court s suggestion that they should be resold urgely abo all what right she has to mislead these guests and tell them you fight with family members and be here illegally shame on us we call her iellectual,1
best reply to feminists liberals www youtube com results search query is a best movie,0
send ranu randy to rachi,2
most honest and elaborate review thank u sir from gujarat jai shri ram,0
being gay is wrong and it is a choice,0
he already uploaded quick review,0
dislikes seems three the those wis who ha filed false case,1
gobinda barman all right,0
u r giving wrong message about gays,0
yes angers and fast and furious are extremely realistic bloody anpadh gawar hypocrite loser,2
watch it in x,0
why this arundhuti is allowed to come to india,0
do just one change to yourself avoid ma chod di gaali it s a ry ry bad manners it ruins your character please,0
ranga and billa did they rape arundhati roy on her request to enjoy illicit sex,0
true and honest review on youtube fak fake pplz,0
janwar black fancy dawood aarushi choudhary,0
bhai phod raha hoon subeh se ko gym phir college cardio meditation and now deep study,0
this guy is husband material where are guys like these,1
a big thanks for making this video i was explaining the exact thing to my friend days ago and here you uploaded the video on this topic,0
kabir singh movie is just for eertainme t connect to this story to ur life becoz onscreen and offscreen mai bhut difference hai,0
just what you need when you watch a hyped movie and you are the only person who see absolute nonsense in the characters of the leads and when you speak the same to people around it s all about shahid ki movie thi absolute rubbish ideas being serd in the society via movies,1
absolutely lod your review,0
u r great lo from bangladesh,0
really you tried to analyze the cinematography of the movie joker and so much sympathy on the character if someone like a depressed person got inspired by this movie and kills a person then what stop this oraction and try to watch kabir singh from technical poi of view like what u did for joker t gi lectures on how the character should beha in the movie like kabir took drugs and left preeti so he is not responsible shut the f up sandeep vanga is going to direct a crime movie prepare some pois on how the characters should beha in that upcoming movie and send it to sandeep stupid,1
its my first time that i am so early,0
en shahid himself does not like role of,0
now a days you talk more about feminist and liberals rather than taking about the movie,1
who is this lady kasturi why is she here,0
bastardized arundhati s shop shut down so in frustration she is burbling nonsense,2
saikia first of all if my words were harsh then accept my apologies i am a researcher in engineering by profession and i just belie in the facts and technical reasons only so the behavior of any male is completely depends on how his pares raise him and what he s been taught at home nothing else can change once opinion specially films if we teach eryone that its not real and its just for fun and imagination please t feel so offensi because most of the mans are ry good en you might ha friends in boys on whom you can trust one more thing i like iron man so what does it mean should i start jumping from buildings to follow him its about our born brought up lessons madam from which we are quite able to decide what to learn and what not to by the way if some guy is bad then nothing can be e because he will sees the negativity around and will do wrong things only for such persons jail is right place please www youtube com results search query please understand my poi of view,1
also he is topper of college kabir,0
yes buddy i agree you are so clear thats good thing en i like this movie they should change their perspecti if they thing movie is wrong all bhasad is going on that so bad why they are not understanding movie its so simple,1
we are all indian we t ha any problem from the gornme why arundhathi roy and capil and all people ha problem why we need to all explain about nrc cab,0
ajay kumar gupta ase bhi india is d second most populated coury in d world for your kind information n yeah lo doesn t see anything i am straight but i support lgbt,0
i t care if my son or daughter is gay it would be difficult for me to understand him but i ll manage also if i get bisexual wife then i ll be glad she won t mind threesome,0
reject caa boycott nrc boycott npr,2
you are wasting your time while talking about such a poisonous women who thinks she is abo from the unirse what a nonsense women she is she is living in this coury try to destroy this couries institution making a fun of people s mandate,2
uscirf have you hered dear arnab also heared un thousand crores wasted on adaar to print this is not a document for citizenship your bark will not work my dear,0
you desers bohot kuch sir hats off,0
this woman is high on some cheap crack,0
what is the objecti of this lady,0
after this i found arjun reddy is far better and realistic,0
completed my pg before eryone else i mean i was the youngest among my classmates but i was always mature than eryone,0
your are great sir,0
could someone please translate this matter io english i would like to know what this man did to take renge,0
they are bhaavook emotional chutiyas,1
why r u debating this topic why not debating on india economy which is in icu unemployme i do understand why en ppl participate in like this kind of debate,0
first video which han t made fun or criticized after the rdict good work,0
do you wear this t shirt in public if yes then hats off to you bro,0
hypocrisy is a disease,0
but to be honest i ha seen girls who like this kind of individuals,0
i think you are one of the most honest youtubers on the platform respect,0
ranu mandal is not a good singer,2
really nice analysis as always,0
who the hell r these liberals and feminist assholes kick them all,2
also veere di wedding fake feminist piece of shit,0
plz talk on movie plz talk on story script craft acting boring review plz talk on movie,1
great way to justify an unreal character as if he is your father,1
i appreciate what you are saying i will always support you whater it takes,0
saw the eire review and she is gandu feminist,2
pseudo feminism has become a trend and actual feminism a myth,1
arundhati roy is a disgrace to india it s sad,0
bro how can you be so great its a pleasure to listen to your thoughts so straight to the poi and realistic,0
you got a subscriber,0
islam is peaceful religion eryone know this hei man what do you know about of islam last warning for you t bad commes of islam,0
ladies are criminal prone,2
this lady is lost sanity need to b se to meal asylum in guatmao need to b thrown out of the coury v r better off minus such traitors,0
why this channel and mr arnab goswamy not conducting debates on casteism in india discrimination in india corruption in india are these not issues that bleeding india,0
but film has true sense does happen in society simple,0
film companion channel h sbse jyada uske channel pr hi view h review ke m,0
ravish kumar doesn t know the abc of journalism,1
i totally agree with you sir,0
en crores look tough,0
nupur en though ur poi is right ur so bloody irritating shut up listen and then speak,2
i agree with you,0
it s ry good message you ga thanks a lot,0
vipul bisht look around all the men of s do they look as young as ramadhir in his s except for dilip kumar and dharmendra the answer is no that too dharmendra at this age can t run and shoot fire arms unlike ramadhir,0
www youtube com watch v n zmfqmzos t m s ga d marao bhosdike damn true brother,0
perce accepted your words,0
who call this loose kastoori,0
we all knew that the movie was a little or the top the main issue was the selecti outrage from the feminist brigade they critise certain movies that potray male lead characters as domina and vile but at the same time they encourage toxic female behaviours in movies who treat their male couerparts as dog shit we somehow had to defend kabir singh there was no other way around,1
feminism is a cancer,2
a ry good answer to all the pseudo liberals nd pseudo feminists,0
i know arnab is govt funded but on this poi i agree that arundhati roy not required in india,0
how many of the viewers study feminism masculinism instead of watching movies,0
singh okay i need an honest long distance boyfriend,0
few persons whether artist writters economist how many r they are they our future decider my opinion we are coury fate designer they are not newtons or sir einsteins these urban naxaulites are misleading for their personal money wealth put them in the gutter,2
god bless jahangir sir great job,0
how can u talk for so much time and u looking just at the camera which means it s like talking to yourself,0
now a days its become a tact for girls to snatch money from boys family shame on girls for misusing it,1
i agree with you firmly i felt the same thing,0
i do know much about homosexuals but i definitely would say that transgenders should not be allowed,0
arjun reddy and kabir singh both are worst movies nothing so realistic ok,0
waiting for this video best review,0
i hope u didn t watched whole video,0
all producers be like bhos ke,1
dislikes from bollywood actors and actress,0
this must be happened if there is misused of law,1
harish bhandary she is a failed soft porn actress from the south,0
why did censor board beep off abusi words in hindi language in this movie why not in english,0
i actually found ryan reynold s definitely maybe to be a more realistic lo story than kabir singh,0
kaafi tanda tha josh ki kmi thi otherwise awesome keep playing,0
its not movie its my life that s why i t ha courage to see it and watching its story here,0
exactly these assholic memers posted piles of shit memes on social media about this absolutely rubbish and nonsensical film i can t en call it a film such directors should stop making movies asap otherwise already shitty bollywood is going to become en more shittier,2
i am big fan of u lo you thanks for videos,0
hey he looks like poisonous sample ankush,0
such a stupid short film negati impact on the gay community,1
bro see sohum shah s tumbbad ship of thesus and a short film called new borns it is your type of movies and it is extremely underrated because no one really we to watch these films as indians ner support good cinema these films t ha item songs sohum shah is ry underrated,0
akhter madan i am hindu but i respect all religion also with islam,0
you re a true genius,0
when i st heard about her n her voice i sympathized her but when i know about her behavior i started hate her not only me but the whole india i agree with what u said she really need to learn politeness n she is not only the who has such a nice voice,0
goswami haha true that,0
top sameer punjabi hi,0
this is the best review of this movie,0
arrested for what know a little about our constitution let s see who will arrest her,0
finally some genuine reviews about the absurdity going on in the curre bollywood movies,0
hat s off to you bro absolutely right,0
bhai review movie article please,0
one of the worst movies it makes me hate more bollytards sad to see this garbage movie earning that much money,0
this whore is a member of psuedo iellectual secular gang she made a villa in nai st s land,2
no hope for the cigarette smoking whore might as well just get mashed under a truck and that other guy should be bur ali along with the whore that caused his life,0
k singh feels like you t gi f to feminism either cou yourself in,0
ayushman khurana after watching this video mogambo khus hua,0
pratik superb review i lo the movie this is an master piece i ha watch this time i ha to see this again an again,0
be respect woman feeling and good story,0
well e justice delired,0
pratik borade i asked how would you take if singh is muslim not how he will go,0
arnab t gi more importa to mrs roy just take her in custody and demonstrate law exist,0
youtu be vlkh yxuam,0
you share my feelings bro,0
arnab or people like arundhati roy are sponsored by enemies of india to keep india from making progress people like her should not be gin any importance and should be charged so that they are accouable for their seditious actions and speech,0
i was ry curious about the way this film became so famous so thought of watching when it premiered in tv i got bored by ierval i am really shocked how this movie was liked by so many people i agree with you this movie is far from reality and this feminist argumes are also senseless i did like it a bit ya seriously,1
shwetabh bhai you are one of the best youtuber,0
gornme waiting to ierfere with all it s ielligence to keep her mouth shut for er,1
haryanvi jatt man ry ry bc,0
more we look at this woman arundhiti am convinced she is the reincarnation of ravan s sister supernkha,1
we need mens in the army not gay,0
phone sex iam from odisha state bhubaneswar iam just yr iam specialist body massagboy home services available first demo free service available,0
and now we pashtoons are the bitches of punjabis the same punjabis we once ruled the punjabi army can do whater they wa to pashtuns and nobody would say a word besides most muslim rulers of india were of turko mongolic origins,0
nice nice nice nice nice nice nice,0
good analysis u speaks good,0
don t watch after minutes spoiler ahead,0
maurya no i t think so,0
kabir arjun reddy comme which film best,0
www bbc com marathi india,0
we wa to read your book sir please make it available,0
just because one of her books won a prize she considers herself importa neta does she wash her face and mouth p,0
lezion firzt okey so fake acce,0
you exposed your self what is harm for you ha you any guards to make commes or political leaders on their education corol or english and back ground i am not a fan of ranu mondal you must more cautious on language before such commes,2
nice concept guys keep it up,0
awsome understanding and review,0
feminism liberalism cancer as i always say,2
u r fire broo,0
brother please emphasize on review,0
you are right sir bollywood movies can nsr be realistic ones their minds are dash,0
where is the review of singh,0
arundathi roy wa violence,0
is she a lady or some witch,1
sarma i don t like lgbtq and i don t suppo them this is my view my speech i live in a democracy so i want to make these people to leave the country bloody idiots,2
ofcourse the acting is bullshit but the message is gud,1
after so long finally satisfied with the analysis of this shit movie all this time these all thoughts were shouting in my head the two parties both radical male and female feminists had shit on this topic so much but didn t gi any clear picture and impact you earned my respect bro,0
totally agree with you,0
rudra calling her kutti is insult to bitches arundhati is far wretched,0
lo you brother one sane voice amongst thousands of eunches,2
please post videos in mensutra channel also,0
ranu is a gost,2
bakwas movie bt shahid kapoor s acting was faastic,1
look at his t shirt high lel single person like me,0
watch gully boy shwetab bhai i bet you won t be disappoied,0
like if you support against these fake feminists,0
we watch movies to enjoy it that s my view following the character or not depends on the person himself,0
i would reqst all of you to report all such videos that spreads hatred towards anybody if u really wa peace n happiness in this coury or the world d support ppl who complicates things fr their selfishness,2
exactly bro medical line aur kabir movie just opposite hai,0
hi iam from odisha state bhubaneswar i wa make friendship with you and meet with you if you are ierested msg me on whatsapp and call me let see mine,0
pratik bhai on fire,0
one of my friend said gully boy is much better than the tashke files we ner had any discussion on movies after that,0
now it is going on gender bias and you do not lnow about any sury on women in inida first read the all the report and then speak your type of men in inid ais ry dangerous in our society,1
this man is sick,2
k singh yeah u r right it depends who learn what from where someone can learn good thing from the bad but someone can learn bad stuff from the gud stuff too u r absolutely right bcoz few lack to see the depth of the emotion but they only like see the reaction and wa an opportunity to replicate,0
you lost assembly election in last one year,0
arundhati roy should be behind bars,0
bhai eire indian eertainme industry is getting spoiled day by day in name of tv shows we ha bullshit web series is full of gali galoch and sex and reality show is out of reality our movies ha always shown us faltu ka pyaar bollywood assumes that eire indian audience is dumbass and show them anything that s why most of the movies in rece past ha turned out to be a disaster at the box office irrespecti of their starcast i hope they realise the gravity of the situation and think little bit maturely,0
nupur you are mad to shout or someone like this and arnab are you an anchor you let nupur go on shouting and use shitty words for so long,0
i hate these faminisim they t know en the meaning of it and called themsels feminist real woman t care of them,2
that s called haresh me not lo,2
i really appreciate and encourage the people who wish to do so then only the legal terrorists will be scared to lodge a false a cases mr jahangir hates off to you if you are in jail once almost your pis better,0
i think she is half meal plz send her to meal hospital,0
thank you ya for approving my post in facebook mensutra its make me feel good i lo your videos it helped me following since last year,0
the more scary fact is that people actually liked the movie i completely appreciate shahid s acting but the message and the stoy which this movie has man this is toxic but youth in india will soon become scary,1
true review pratik bhai true lo ki jai ho,0
there is nothing in this movie that can amaze any boy specially for girl this movie is may good coz after having so many x they finally wa that some one new came accept them with their dark secrets that y females are liking most this pethetic pies of shit and the respect of a female dr vanish from a common man view that s it,1
arnab goswami sir you as a bengali know what was bengal during independence struggle and how is bengal today after those glorious years of communists and trinamools,0
this lady is the true face of urban naxal and is paid by western couries and isi to destroy india by giving provocati speech she should be put behind bars,2
i am lesbian l lo you who er made this,0
all bitches need a lesson for misusing a all should be killed head shot,2
actual review of the movie starts at www youtube com watch v n zmfqmzos t m s,0
r they hero nd heroine how peculiar they r ravish from india,1
kabir shing jese movie social harming movie,0
bhai i hv seen arjun reddy owsm movie and,0
u r ri bro,0
i am lesbian and i am ry proud to be lesbian,0
arundati is ry rich where she get money who is paying her she looks depressed and senile,0
well e jahangir bai you are great,0
i am your one of the oldest subscriber and according to my judgeme you are clearly damn high if not thn probably extremely sleep deprid,0
this meally ill lady is a barking street dog whose ieions to pull people s atteion that she is ali,0
she is well known pro,0
best movie review for this movie,0
some lines were funny but true,0
when law t do insaf them this happens,0
arnab is not even wo hy to be called a kutta its an insult to a dog,2
agreed ry well said,0
i ha a doubt to ask is this lie detecting test too complicated why can t we use this in these a cases to know whether it s genuine of course women can also lie not just men,0
what about conservatis t be one sided ery side is corrupted and has ignora people,1
you make me think differely please make a video on busshit serd by dice media concept of tinder dating,0
i also like lesbian girl more than normal girl because i think lesbian girl r more iellige than normal girl they r more hot,0
anuroop he s talking shit from st line to last im also against to self destructiness but do tell me to become a emotionless robot if a girl is sile that delops create more opinions www youtube com watch v n zmfqmzos t m s sile people male or female ha more opinions bcz they keep mind calm nd think of seral things and better decision making skills because im also a sile guy i know i ca listen to his shit,0
congress and other left parties will be destroyed again in in next lok sabha election bjp will cross seats these pseudo liberals and pseudo seculars will only make this possible by their acts,0
some of them defaming the movie coz it was directed by a south director and did a better work than so called bollywood crap,1
i lo you so much bro,0
budhdhi randy would be good too,0
i m a feminist but i totally agree with erything you said kabir singh is a masterpiece,0
we the people should take law in our own hands to punish these traitors we just can t depend on our judiciary police and any political parties it s time to rebel against these ai national pigs and go the exte of eliminating them,0
freedom of speech does not mean she ll provoke innoce people to come out and gi them name of ranga and billa i m amazed who the foolish has gin her the booker prize she s not worth it,0
i lo u boss,0
lo you sir i am from canada,0
yes bro ry nice poi you explain us,0
this ancore and this tv news chanel did not know any things about to matter of army and kashmir he always bring the unnecessary drama,1
joker review lo from pakistan,0
south movie fans like here they are best than bollywood movie,0
u are much negati,0
this movie was copied copycat bollywood,0
approval of lgbt might reduce or population in india,0
i was waiting for this video since a long time,0
kabir singh director after watching this review will take morphin thats for sure,1
anywhere in the world she be locked up in the peace loving islamist coury s she be stoned to death india giving too much freedom for scums like her,2
mere dil ki baat bol di i told these things to my friends but eryone stopped talking to me after that,0
couldn t agree more,0
fuck boy play boy,0
bro joker movie review like it who all wa him to do,0
www youtube com watch v dctvge p a t m s,0
vhai tmi bong guy theke onek cool so what s upp bro,0
you should also talk about his acting skill we know the story was worse,0
girll right i just found that wrong talk abouth positi also shwetabh,0
not agree with you,0
the silly old man saying i m ranga billa,0
i jst hate her ranu beggar,2
raja ch lo you bro i m going again a,0
why animals other than humans do ha these same sex attraction backchodi hai ye homo lomo huh my life my choice mera bhi man karta hai gta jaise gun le kar nikal jaaun road pe insaan ki dimag ki bakwas hai ye,2
i lo you sir,0
hello my self sumit from india from kola i just wanna say you are most beautiful porimam bangladesh is most beautiful coury and having a lots of loly people so porimam you are looking ry nice i am your fan sumit,0
positi the kind of insults and accusations you ha berated me with real the true nature of feminism,2
you really wa to spoil such masterpieces,0
the art of knowing is to know what to ignore purequotes u,0
i totally agree with your thoughts,0
it s been told by many of the iellectual if you really waed to be rather than abusing movie take a mome and aware people en in usa and korean film industry where the coe is more deloped movies are the same some high coe we use to see and low coe we t en talk about so called film making ko buckchodi bolne se behtar hai start mome with your own followers else you were so irritating in this video thanks,1
right you are preteious ppls are those who dislike the,0
modi clearly declared every child can listen citizen of india are all one owaisi and rahul creating on purpose and arranging thse kind of dogs to come on tv all are paid,2
is she really a girl or transgender,0
she should be jailed,0
team naughty world fab again u guys rock keep it up waiting for more stuffs,0
who cares the randi,2
